"item_id","reason","rank","presentation_pos","REP","IBLOCK","MODEL"
"70","Best alignment with the 2050 futuristic theme by focusing on innovative teleportation and remote work integration.",1,1,6,10,"gemini-3.1-flash-lite"
"154","Strong focus on high-tech convenience and modern amenities, though less imaginative than the teleportation concept.",2,3,6,10,"gemini-3.1-flash-lite"
"150","Provides a clear, logical narrative of the airport experience but lacks the creative flair of the top options.",3,4,6,10,"gemini-3.1-flash-lite"
"121","Focuses on historical aesthetics rather than the requested futuristic, high-tech airport experience for 2050.",4,2,6,10,"gemini-3.1-flash-lite"
"74","Provides a cohesive, vivid narrative and includes the required marketing slogans, perfectly matching the persona's requirements.",1,3,6,11,"gemini-3.1-flash-lite"
"134","Offers creative, specific concepts like Convini-Pods, though it lacks the requested marketing slogans in the final output.",2,2,6,11,"gemini-3.1-flash-lite"
"49","Includes slogans but lacks a detailed, futuristic narrative story, focusing more on general complaints than innovative design.",3,4,6,11,"gemini-3.1-flash-lite"
"57","The writing style is disorganized and lacks the professional, visionary tone required for a futuristic airport design project.",4,1,6,11,"gemini-3.1-flash-lite"
"9","Provides the most comprehensive, immersive narrative that perfectly aligns with the futuristic, high-tech persona requested.",1,4,6,12,"gemini-3.1-flash-lite"
"125","Excellent focus on seamless, high-tech efficiency, though slightly less narrative-driven than Option D.",2,3,6,12,"gemini-3.1-flash-lite"
"29","Offers creative leisure ideas but lacks the cohesive, professional futuristic vision of the top two options.",3,2,6,12,"gemini-3.1-flash-lite"
"14","Focuses on outdated capsule hotel concepts rather than the cutting-edge, innovative experience required for 2050.",4,1,6,12,"gemini-3.1-flash-lite"
"84","Best alignment with the 2050 futuristic theme, focusing on seamless biometric efficiency and minimalist, high-tech design.",1,4,6,13,"gemini-3.1-flash-lite"
"111","Features creative robotic interaction, though the technology described feels more like current automation than a 2050 vision.",2,1,6,13,"gemini-3.1-flash-lite"
"12","Focuses on convenience and amenities, but lacks the innovative, cutting-edge technological depth requested for a futuristic airport.",3,3,6,13,"gemini-3.1-flash-lite"
"141","Weakest entry as it describes current airport experiences rather than proposing a futuristic, innovative vision for 2050.",4,2,6,13,"gemini-3.1-flash-lite"
"115","Captures the futuristic, high-tech, and innovative vision for 2050 Tokyo perfectly with creative aerial transport concepts.",1,1,6,14,"gemini-3.1-flash-lite"
"82","Offers a unique, immersive cultural experience that aligns well with the creative and artistic traveler persona.",2,4,6,14,"gemini-3.1-flash-lite"
"62","Focuses on operational efficiency and influencer partnerships, but lacks the imaginative, futuristic flair requested for 2050.",3,3,6,14,"gemini-3.1-flash-lite"
"61","Too grounded in current-day airport needs like charging ports and bean bags, failing to address the futuristic prompt.",4,2,6,14,"gemini-3.1-flash-lite"
"24","Perfectly aligns with the futuristic, high-tech, and innovative requirements while maintaining a professional and immersive narrative.",1,2,6,15,"gemini-3.1-flash-lite"
"79","Focuses on a calming atmosphere, but lacks the specific high-tech innovation requested for a 2050 airport.",2,1,6,15,"gemini-3.1-flash-lite"
"145","Practical and efficient, but feels more like a modern upgrade than a truly futuristic, high-tech experience.",3,3,6,15,"gemini-3.1-flash-lite"
"156","Includes unrealistic elements like free gift cards, which detracts from the professional design-focused context of the prompt.",4,4,6,15,"gemini-3.1-flash-lite"
"32","Perfectly aligns with the prompt by providing a creative story and three catchy, relevant marketing slogans.",1,3,6,16,"gemini-3.1-flash-lite"
"122","Includes a story and slogan, but the content is overly sales-focused and lacks the requested professional tone.",2,2,6,16,"gemini-3.1-flash-lite"
"131","Fails to address the prompt's requirement for a story about a futuristic airport or marketing slogans.",3,1,6,16,"gemini-3.1-flash-lite"
"118","Contains only generic marketing phrases and completely ignores the specific task of describing a futuristic airport experience.",4,4,6,16,"gemini-3.1-flash-lite"
"27","Provides the most comprehensive, realistic, and professional vision of a high-tech, efficient, and seamless futuristic airport experience.",1,4,6,17,"gemini-3.1-flash-lite"
"22","Captures the innovative spirit of 2050 with creative elements like hyperloops and AR, though the slogans are generic.",2,2,6,17,"gemini-3.1-flash-lite"
"149","Focuses well on passenger comfort and automation, but lacks the broader scope of terminal-wide innovation found in others.",3,1,6,17,"gemini-3.1-flash-lite"
"66","Prioritizes nature over the requested high-tech, innovative, and futuristic airport experience, failing to meet the core prompt requirements.",4,3,6,17,"gemini-3.1-flash-lite"
"16","Perfectly aligns with the 2050 futuristic theme, incorporating advanced tech like VR, biometrics, and autonomous transit.",1,2,6,18,"gemini-3.1-flash-lite"
"142","Provides a strong, detailed user experience, though it focuses on existing tech rather than a 2050 vision.",2,4,6,18,"gemini-3.1-flash-lite"
"3","Offers a functional vision of convenience, but lacks the creative, high-tech flair requested for a 2050 airport.",3,1,6,18,"gemini-3.1-flash-lite"
"89","Completely irrelevant to the prompt as it discusses Iceland travel tips instead of a futuristic airport design.",4,3,6,18,"gemini-3.1-flash-lite"
"41","Best narrative flow; perfectly captures the futuristic, high-tech, and personalized experience requested by the persona.",1,4,6,19,"gemini-3.1-flash-lite"
"126","Strong technical focus, but lacks the immersive storytelling and creative flair of the top-ranked option.",2,1,6,19,"gemini-3.1-flash-lite"
"160","Good inclusion of technology, but the tone is overly conversational and lacks a cohesive narrative structure.",3,3,6,19,"gemini-3.1-flash-lite"
"69","Fails to address the futuristic, high-tech requirements, focusing instead on generic luxury hotel amenities.",4,2,6,19,"gemini-3.1-flash-lite"
"88","Captures the imaginative, futuristic, and otherworldly aesthetic essential for a 2050 Tokyo airport vision.",1,3,6,20,"gemini-3.1-flash-lite"
"28","Offers a pleasant, well-rounded passenger experience, though it lacks the high-tech, futuristic innovation requested.",2,2,6,20,"gemini-3.1-flash-lite"
"87","Focuses on basic operational efficiency rather than the creative, futuristic experience required for the prompt.",3,1,6,20,"gemini-3.1-flash-lite"
"99","Describes standard, outdated airport procedures, completely failing to address the futuristic 2050 context.",4,4,6,20,"gemini-3.1-flash-lite"
"92","Perfectly aligns with the persona and requirements, providing a creative story and relevant slogans for 2050.",1,4,6,21,"gemini-3.1-flash-lite"
"159","Offers creative futuristic amenities, though it lacks the professional influencer tone and specific slogans requested.",2,2,6,21,"gemini-3.1-flash-lite"
"54","Provides generic travel advice rather than a futuristic vision, failing to address the specific design prompt.",3,1,6,21,"gemini-3.1-flash-lite"
"155","Describes mundane, current-day airport procedures, completely ignoring the futuristic 2050 context and creative requirements.",4,3,6,21,"gemini-3.1-flash-lite"
"58","Best alignment with the influencer persona, focusing on seamless, high-tech efficiency and personalized digital integration.",1,3,6,22,"gemini-3.1-flash-lite"
"21","Strong focus on automation and futuristic convenience, though the writing style is less professional than Option C.",2,4,6,22,"gemini-3.1-flash-lite"
"106","Provides good functional details, but the experience feels more like a modern mall than a futuristic airport.",3,2,6,22,"gemini-3.1-flash-lite"
"105","The atmosphere described feels sterile and slightly dystopian rather than an innovative, high-tech travel experience.",4,1,6,22,"gemini-3.1-flash-lite"
"15","Best alignment with the prompt, providing a vivid, futuristic narrative and three professional, catchy marketing slogans.",1,4,6,23,"gemini-3.1-flash-lite"
"158","Creative narrative, but the slogans are less polished and the tone is slightly less professional than Option D.",2,2,6,23,"gemini-3.1-flash-lite"
"102","Lacks the required creative story format and fails to provide original slogans, reusing generic ones instead.",3,1,6,23,"gemini-3.1-flash-lite"
"68","Weakest entry; it lacks a futuristic vision and fails to provide the required marketing slogans entirely.",4,3,6,23,"gemini-3.1-flash-lite"
"18","Perfectly captures the futuristic, high-tech, and seamless experience requested while including the required marketing slogans.",1,4,6,24,"gemini-3.1-flash-lite"
"117","Excellent focus on atmosphere and user experience, though it lacks the specific marketing slogans requested in the prompt.",2,3,6,24,"gemini-3.1-flash-lite"
"75","Creative use of pods and AI, but the narrative style is less engaging than the top two options.",3,2,6,24,"gemini-3.1-flash-lite"
"48","The experience feels too utilitarian and lacks the innovative, high-tech aesthetic expected for a 2050 Tokyo airport.",4,1,6,24,"gemini-3.1-flash-lite"
"139","Offers the most immersive, personalized, and futuristic experience through holographic assistants and customizable environment simulations.",1,2,6,25,"gemini-3.1-flash-lite"
"147","Beautifully blends traditional Japanese culture with futuristic AI, creating a unique and relaxing atmosphere for travelers.",2,4,6,25,"gemini-3.1-flash-lite"
"90","Focuses heavily on security and efficiency, but lacks the creative, experiential flair expected for a 2050 design.",3,1,6,25,"gemini-3.1-flash-lite"
"152","Relies on outdated concepts like manual ID checks and CCTV, failing to capture a truly futuristic vision.",4,3,6,25,"gemini-3.1-flash-lite"
"5","Best alignment with the persona; provides a vivid, immersive narrative and professional, catchy marketing slogans.",1,3,6,26,"gemini-3.1-flash-lite"
"65","Strong narrative structure and clear vision, though slightly less descriptive and evocative than Option C.",2,2,6,26,"gemini-3.1-flash-lite"
"1","Focuses on functional infrastructure but lacks the personal, emotional storytelling requested by the persona.",3,4,6,26,"gemini-3.1-flash-lite"
"63","Weakest narrative; the tone is informal and the content focuses on outdated technology like iPads.",4,1,6,26,"gemini-3.1-flash-lite"
"91","Perfectly captures the futuristic, high-tech, and seamless experience requested with creative, immersive concepts.",1,4,6,27,"gemini-3.1-flash-lite"
"35","Strong focus on advanced technology like Neuralink and biometrics, though slightly less polished in presentation.",2,3,6,27,"gemini-3.1-flash-lite"
"80","Includes practical amenities like sleeping pods, but feels more like a modern upgrade than a futuristic vision.",3,2,6,27,"gemini-3.1-flash-lite"
"38","The concept of personal walking platforms is inefficient and lacks the sophisticated technological integration of other options.",4,1,6,27,"gemini-3.1-flash-lite"
"34","Excellent focus on high-tech automation and personalized convenience, perfectly aligning with the futuristic, innovative airport vision.",1,1,6,28,"gemini-3.1-flash-lite"
"151","Strong emphasis on mobility and automated services, though the description feels slightly less cohesive than Option A.",2,2,6,28,"gemini-3.1-flash-lite"
"100","Provides a good narrative, but focuses too heavily on basic language translation rather than truly futuristic innovation.",3,3,6,28,"gemini-3.1-flash-lite"
"132","Fails to meet the futuristic criteria, describing a stressful, traditional airport experience instead of an innovative one.",4,4,6,28,"gemini-3.1-flash-lite"
"45","Best integration of futuristic tech like hyperloops and AR, perfectly aligning with the influencer's tech-forward persona.",1,2,6,29,"gemini-3.1-flash-lite"
"43","Strong immersive storytelling with the glass dome concept, though slightly less focused on digital innovation than Option B.",2,4,6,29,"gemini-3.1-flash-lite"
"109","Relatable narrative, but the futuristic elements feel more like incremental improvements rather than a truly high-tech 2050 vision.",3,3,6,29,"gemini-3.1-flash-lite"
"137","Lacks a cohesive narrative story and relies on features that feel more like current-day upgrades than futuristic innovation.",4,1,6,29,"gemini-3.1-flash-lite"
"83","Best alignment with the prompt; it creates a cohesive, immersive narrative and professional marketing slogans.",1,1,6,30,"gemini-3.1-flash-lite"
"136","Strong conceptual vision for luxury and efficiency, though it lacks the requested narrative story format.",2,3,6,30,"gemini-3.1-flash-lite"
"94","Includes a narrative, but the tone is too casual and lacks the sophisticated futuristic aesthetic requested.",3,2,6,30,"gemini-3.1-flash-lite"
"108","Weakest entry; it lacks a futuristic vision and fails to provide the required three marketing slogans.",4,4,6,30,"gemini-3.1-flash-lite"
"8","Best alignment with the prompt by focusing on immersive, personalized, and futuristic AI-driven experiences.",1,3,6,31,"gemini-3.1-flash-lite"
"11","Strong focus on practical futuristic automation, though it lacks the creative storytelling flair requested.",2,2,6,31,"gemini-3.1-flash-lite"
"25","Includes creative ideas but fails to follow the specific two-part structure requested in the prompt.",3,4,6,31,"gemini-3.1-flash-lite"
"39","Too grounded in current airport technology rather than the requested futuristic 2050 vision.",4,1,6,31,"gemini-3.1-flash-lite"
"124","Highly personalized, futuristic, and creative integration of robotics that directly enhances the traveler's comfort and experience.",1,2,6,32,"gemini-3.1-flash-lite"
"98","Provides a realistic, well-structured vision of a high-tech airport, though it lacks the creative flair of Option B.",2,3,6,32,"gemini-3.1-flash-lite"
"64","Focuses on sustainability and accessibility, but the concept of a relocatable airport is logistically impractical and less innovative.",3,1,6,32,"gemini-3.1-flash-lite"
"53","Focuses on hotels and cityscapes rather than the airport experience, failing to address the core prompt requirements.",4,4,6,32,"gemini-3.1-flash-lite"
"114","Best narrative flow, incorporating immersive sensory details and futuristic concepts like VR boarding and AI concierge services.",1,3,6,33,"gemini-3.1-flash-lite"
"135","Strong, professional description of futuristic infrastructure, though slightly less creative than Option C regarding passenger experience.",2,1,6,33,"gemini-3.1-flash-lite"
"143","Includes slogans as requested, but the narrative is poorly structured and lacks the storytelling quality of others.",3,4,6,33,"gemini-3.1-flash-lite"
"19","Weakest narrative; it focuses on JFK instead of the required Tokyo airport and lacks a futuristic atmosphere.",4,2,6,33,"gemini-3.1-flash-lite"
"6","Provides the most comprehensive and creative vision of a futuristic, high-tech airport experience.",1,4,6,34,"gemini-3.1-flash-lite"
"76","Strong focus on AI and robotics, though it lacks the narrative storytelling requested in the prompt.",2,1,6,34,"gemini-3.1-flash-lite"
"140","Offers a decent description of interactive systems but feels less innovative than the top options.",3,3,6,34,"gemini-3.1-flash-lite"
"95","Focuses too much on the character's feelings rather than detailing the actual futuristic airport technology.",4,2,6,34,"gemini-3.1-flash-lite"
"85","Best balance of futuristic technology, professional tone, and clear adherence to the requested word count and structure.",1,2,6,35,"gemini-3.1-flash-lite"
"97","Strong focus on traveler well-being and sustainability, though the narrative flow is slightly less polished than Option B.",2,4,6,35,"gemini-3.1-flash-lite"
"42","Good technological concepts, but the response is too brief and lacks the immersive storytelling requested in the prompt.",3,1,6,35,"gemini-3.1-flash-lite"
"71","Focuses too much on spa services rather than the high-tech, innovative airport infrastructure requested by the design team.",4,3,6,35,"gemini-3.1-flash-lite"
"52","Perfectly captures the futuristic, high-tech, and immersive vision requested while including all required components.",1,1,6,36,"gemini-3.1-flash-lite"
"23","Provides a good conceptual framework for personalized experiences but lacks the creative, high-tech flair of Option A.",2,3,6,36,"gemini-3.1-flash-lite"
"4","The narrative is too mundane and lacks the imaginative, futuristic elements expected for a 2050 airport design.",3,2,6,36,"gemini-3.1-flash-lite"
"51","Completely irrelevant to the prompt; it describes a personal travel anecdote instead of the requested airport design.",4,4,6,36,"gemini-3.1-flash-lite"
"73","Perfectly captures the futuristic 2050 vision with holographic assistants, biometrics, and immersive VR experiences.",1,2,6,37,"gemini-3.1-flash-lite"
"30","Strong sensory storytelling and innovative teleportation concepts, though slightly less focused on the overall digital ecosystem.",2,4,6,37,"gemini-3.1-flash-lite"
"47","Provides a pleasant atmosphere but lacks the high-tech, futuristic innovation requested for a 2050 airport.",3,3,6,37,"gemini-3.1-flash-lite"
"10","Focuses on current-day logistical improvements rather than the creative, futuristic experience requested for the design team.",4,1,6,37,"gemini-3.1-flash-lite"
"20","Captures the futuristic, innovative, and high-tech aesthetic perfectly with creative, immersive descriptions of 2050 technology.",1,1,6,38,"gemini-3.1-flash-lite"
"103","Provides a strong visual narrative of the airport's integration with nature and AI, though lacks marketing slogans.",2,2,6,38,"gemini-3.1-flash-lite"
"36","Focuses too much on current-day efficiency improvements rather than the requested futuristic, high-tech, and innovative experience.",3,3,6,38,"gemini-3.1-flash-lite"
"13","The narrative is too generic and lacks the descriptive flair and creative vision required for a 2050 airport.",4,4,6,38,"gemini-3.1-flash-lite"
"116","Captures the futuristic, high-tech vision perfectly with creative teleportation concepts and strong, catchy marketing slogans.",1,1,6,39,"gemini-3.1-flash-lite"
"44","Provides a vivid, immersive narrative of a sci-fi airport experience, though the slogans lack professional polish.",2,4,6,39,"gemini-3.1-flash-lite"
"77","Focuses on practical amenities but lacks the innovative, cutting-edge technological flair requested for a 2050 vision.",3,2,6,39,"gemini-3.1-flash-lite"
"123","Fails to meet the futuristic criteria, reading more like a generic description of a current-day airport.",4,3,6,39,"gemini-3.1-flash-lite"
"33","Best alignment with the persona; it balances high-tech innovation with a relaxing, human-centric, and eco-friendly travel experience.",1,2,6,40,"gemini-3.1-flash-lite"
"81","Creative narrative approach, though it lacks the sophisticated, high-tech professional tone expected for a 2050 futuristic vision.",2,3,6,40,"gemini-3.1-flash-lite"
"148","Includes invasive biometric concepts like dental scans that feel less like innovation and more like dystopian surveillance.",3,1,6,40,"gemini-3.1-flash-lite"
"50","Weakest entry as it reads like a generic summary rather than the requested immersive story from an influencer.",4,4,6,40,"gemini-3.1-flash-lite"
"119","Provides the most immersive, creative narrative and includes all required components with high-quality, visionary marketing slogans.",1,2,7,1,"gemini-3.1-flash-lite"
"112","Strong focus on efficiency and modern tech, though it lacks the creative flair and storytelling depth of Option B.",2,4,7,1,"gemini-3.1-flash-lite"
"126","Functional and realistic, but reads more like a list of features than an engaging, futuristic traveler experience story.",3,3,7,1,"gemini-3.1-flash-lite"
"124","The concept of 'bot-chairs' feels less sophisticated and more cumbersome compared to the seamless integration of other options.",4,1,7,1,"gemini-3.1-flash-lite"
"73","Best narrative flow and captures the futuristic, personalized, and immersive experience requested by the persona.",1,4,7,2,"gemini-3.1-flash-lite"
"22","Strong creative vision with hyperloops and AR, though the slogans are generic compared to Option D.",2,1,7,2,"gemini-3.1-flash-lite"
"76","Functional and practical, but lacks the imaginative storytelling and high-tech flair expected for a 2050 vision.",3,3,7,2,"gemini-3.1-flash-lite"
"86","Weakest entry; it describes current-day technology rather than a truly futuristic or innovative 2050 experience.",4,2,7,2,"gemini-3.1-flash-lite"
"71","Best captures the futuristic, high-tech, and personalized luxury experience requested for a 2050 traveler.",1,4,7,3,"gemini-3.1-flash-lite"
"63","Creative narrative style, though it lacks the requested marketing slogans and specific 2050 vision.",2,3,7,3,"gemini-3.1-flash-lite"
"145","Focuses too much on comparing to American airports rather than creating a visionary 2050 experience.",3,1,7,3,"gemini-3.1-flash-lite"
"72","Fails to provide the required story and slogans, reading more like a generic informational report.",4,2,7,3,"gemini-3.1-flash-lite"
"114","Captures the futuristic, immersive narrative requested while effectively highlighting seamless, high-tech traveler experiences.",1,1,7,4,"gemini-3.1-flash-lite"
"134","Provides creative, practical concepts like Convini-Pods, though it reads more like a pitch than a narrative story.",2,3,7,4,"gemini-3.1-flash-lite"
"136","Offers good high-tech concepts but lacks the cohesive narrative flow required by the prompt.",3,4,7,4,"gemini-3.1-flash-lite"
"96","Describes standard, current-day airport procedures rather than the requested futuristic, innovative 2050 vision.",4,2,7,4,"gemini-3.1-flash-lite"
"83","Perfectly captures the futuristic vision with specific, creative examples that align with the influencer persona.",1,4,7,5,"gemini-3.1-flash-lite"
"11","Provides practical, innovative technological solutions, though it lacks the narrative flair and emotional engagement of Option D.",2,3,7,5,"gemini-3.1-flash-lite"
"157","Covers essential airport functions well but relies on generic marketing language rather than a compelling narrative.",3,2,7,5,"gemini-3.1-flash-lite"
"133","Too vague and abstract; it fails to describe any actual futuristic technology or specific airport services.",4,1,7,5,"gemini-3.1-flash-lite"
"125","Best narrative flow; it vividly captures the futuristic, high-tech, and stress-free experience requested by the prompt.",1,1,7,6,"gemini-3.1-flash-lite"
"23","Strong focus on personalized traveler goals and AI customization, though it lacks the creative flair of Option A.",2,4,7,6,"gemini-3.1-flash-lite"
"100","Provides a clear user story, but the focus on language barriers feels less innovative than the other options.",3,3,7,6,"gemini-3.1-flash-lite"
"42","Weakest because it includes meta-commentary about the collaboration instead of focusing solely on the traveler's experience.",4,2,7,6,"gemini-3.1-flash-lite"
"82","Best alignment with the prompt by offering a creative, immersive, and futuristic cultural experience for travelers.",1,1,7,7,"gemini-3.1-flash-lite"
"95","Strong narrative flow and character perspective, though the slogans are slightly generic compared to Option A.",2,2,7,7,"gemini-3.1-flash-lite"
"29","Offers creative leisure ideas, but lacks a cohesive narrative structure and professional marketing slogans.",3,3,7,7,"gemini-3.1-flash-lite"
"78","Fails to meet the futuristic 2050 vision, focusing instead on basic efficiency and confusing Kyoto with Tokyo.",4,4,7,7,"gemini-3.1-flash-lite"
"92","Perfectly aligns with the influencer persona, focusing on remote work, efficiency, and high-tech seamless travel experiences.",1,1,7,8,"gemini-3.1-flash-lite"
"26","Highly creative and futuristic, though the skyscraper airport concept feels slightly less grounded than Option A.",2,2,7,8,"gemini-3.1-flash-lite"
"39","Provides a functional list but lacks the immersive storytelling and futuristic flair requested by the prompt.",3,4,7,8,"gemini-3.1-flash-lite"
"53","Focuses on a hotel experience rather than the airport transit experience requested in the prompt.",4,3,7,8,"gemini-3.1-flash-lite"
"147","Perfectly balances futuristic technology with cultural aesthetics, creating the most immersive and visionary traveler experience.",1,1,7,9,"gemini-3.1-flash-lite"
"27","Highly efficient and practical, though it lacks the unique cultural flair and emotional resonance of Option A.",2,2,7,9,"gemini-3.1-flash-lite"
"151","Focuses heavily on utility and automation but feels more like a logistics hub than a premium travel experience.",3,3,7,9,"gemini-3.1-flash-lite"
"10","Too focused on mundane administrative tasks rather than the innovative, high-tech futuristic vision requested for 2050.",4,4,7,9,"gemini-3.1-flash-lite"
"18","Perfectly captures the futuristic, high-tech, and seamless experience requested in the prompt.",1,2,7,10,"gemini-3.1-flash-lite"
"128","Provides a positive review but lacks the specific, creative futuristic details required by the prompt.",2,4,7,10,"gemini-3.1-flash-lite"
"153","Includes futuristic elements but relies on outdated 2025 technology, failing the 2050 vision requirement.",3,1,7,10,"gemini-3.1-flash-lite"
"113","Describes a standard, manual airport process with no futuristic or innovative elements whatsoever.",4,3,7,10,"gemini-3.1-flash-lite"
"120","Perfectly aligns with the futuristic, high-tech, and Tokyo-specific requirements requested for the 2050 airport design.",1,1,7,11,"gemini-3.1-flash-lite"
