"item_id","reason","rank","presentation_pos","REP","IBLOCK","MODEL"
"35","Best narrative flow; it uniquely integrates advanced concepts like Neuralink and biometric-only travel for a truly futuristic feel.",1,2,1,1,"gemini-3.1-flash-lite"
"56","Strong, comprehensive list of futuristic features, though it reads more like a feature summary than a personal story.",2,3,1,1,"gemini-3.1-flash-lite"
"16","Covers essential futuristic elements but lacks the immersive storytelling quality and creative flair of the top options.",3,4,1,1,"gemini-3.1-flash-lite"
"37","Weakest entry; it describes current technology rather than the requested 2050 futuristic vision.",4,1,1,1,"gemini-3.1-flash-lite"
"104","Best alignment with the prompt by detailing futuristic tech like AR, hyperloops, and AI-driven personalization.",1,3,1,2,"gemini-3.1-flash-lite"
"138","Good narrative flow, but lacks the creative depth and visionary scope found in Option C.",2,1,1,2,"gemini-3.1-flash-lite"
"50","Provides a logical overview but fails to present the required narrative story format.",3,2,1,2,"gemini-3.1-flash-lite"
"121","Focuses on historical themes rather than the requested futuristic, high-tech airport experience.",4,4,1,2,"gemini-3.1-flash-lite"
"147","Perfectly captures the futuristic 2050 vision by blending traditional Japanese aesthetics with seamless AI and drone integration.",1,4,1,3,"gemini-3.1-flash-lite"
"149","Strong focus on high-tech convenience and immersive digital experiences, though it lacks the cultural depth of Option D.",2,1,1,3,"gemini-3.1-flash-lite"
"159","Offers many amenities but feels like a collection of current-day features rather than a truly futuristic 2050 experience.",3,2,1,3,"gemini-3.1-flash-lite"
"132","Fails to meet the futuristic criteria, focusing instead on negative, outdated security procedures and stressful travel experiences.",4,3,1,3,"gemini-3.1-flash-lite"
"41","Best integration of AI, AR, and robotics, perfectly capturing the futuristic, high-tech Tokyo 2050 vision requested.",1,3,1,4,"gemini-3.1-flash-lite"
"45","Strong vision with hyperloop and biometric tech, though slightly less descriptive than Option C regarding personal experience.",2,4,1,4,"gemini-3.1-flash-lite"
"34","Focuses on practical utility like luggage robots, but lacks the immersive, high-tech atmosphere requested by the prompt.",3,2,1,4,"gemini-3.1-flash-lite"
"79","Too focused on nature and manual staffing; fails to incorporate the requested cutting-edge technology and futuristic innovation.",4,1,1,4,"gemini-3.1-flash-lite"
"148","Best alignment with the prompt by providing both a creative futuristic story and three catchy marketing slogans.",1,1,1,5,"gemini-3.1-flash-lite"
"12","Provides a coherent narrative and slogans, though the writing style is less polished than Option A.",2,4,1,5,"gemini-3.1-flash-lite"
"10","Focuses on practical service improvements but fails to provide the required marketing slogans or futuristic narrative.",3,2,1,5,"gemini-3.1-flash-lite"
"133","Too abstract and lacks the specific technological focus requested for a futuristic airport experience.",4,3,1,5,"gemini-3.1-flash-lite"
"27","Best balance of futuristic technology, seamless flow, and professional tone fitting the influencer persona.",1,3,1,6,"gemini-3.1-flash-lite"
"112","Strong focus on high-tech integration, though slightly less descriptive than Option C regarding the overall environment.",2,1,1,6,"gemini-3.1-flash-lite"
"107","Engaging personal narrative, but the focus on bathroom hygiene is less innovative than the other options.",3,2,1,6,"gemini-3.1-flash-lite"
"145","Lacks the futuristic, high-tech vision requested, focusing more on basic operational improvements than innovation.",4,4,1,6,"gemini-3.1-flash-lite"
"85","Perfectly aligns with the prompt requirements by providing both a creative story and three catchy marketing slogans.",1,4,1,7,"gemini-3.1-flash-lite"
"103","Provides a vivid, immersive narrative of a futuristic airport but fails to include the required marketing slogans.",2,2,1,7,"gemini-3.1-flash-lite"
"82","Offers creative ideas but lacks a cohesive story structure and focuses too narrowly on museum-style experiences.",3,1,1,7,"gemini-3.1-flash-lite"
"113","Describes a standard, current-day airport process rather than the requested futuristic, high-tech 2050 vision.",4,3,1,7,"gemini-3.1-flash-lite"
"32","Captures the futuristic, high-tech, and innovative spirit requested while providing a vivid, immersive narrative experience.",1,3,1,8,"gemini-3.1-flash-lite"
"65","Provides a solid, realistic vision of 2050 technology, though it lacks the creative flair of Option C.",2,1,1,8,"gemini-3.1-flash-lite"
"146","Focuses too much on general amenities like showers rather than the requested high-tech, futuristic airport experience.",3,2,1,8,"gemini-3.1-flash-lite"
"64","Fails to provide the required narrative story and marketing slogans, presenting only a list of functional requirements.",4,4,1,8,"gemini-3.1-flash-lite"
"44","Captures the futuristic, high-tech, and innovative spirit requested for a 2050 Tokyo airport experience.",1,3,1,9,"gemini-3.1-flash-lite"
"14","Provides a practical, user-centric solution for long layovers, though it lacks the high-tech flair requested.",2,4,1,9,"gemini-3.1-flash-lite"
"69","Focuses too much on generic luxury rather than the specific futuristic, high-tech vision required.",3,1,1,9,"gemini-3.1-flash-lite"
"152","The tone is overly bureaucratic and lacks the creative, immersive storytelling expected for a futuristic concept.",4,2,1,9,"gemini-3.1-flash-lite"
"114","Perfectly captures the futuristic, high-tech, and personalized experience requested for the 2050 Tokyo airport vision.",1,3,1,10,"gemini-3.1-flash-lite"
"102","Provides a comprehensive list of functional high-tech features, though it lacks the narrative storytelling requested.",2,2,1,10,"gemini-3.1-flash-lite"
"53","Focuses on hotel experiences rather than the airport environment, failing to address the core prompt requirements.",3,1,1,10,"gemini-3.1-flash-lite"
"17","Fails to address technology or innovation, focusing instead on exclusionary travel preferences that ignore the prompt.",4,4,1,10,"gemini-3.1-flash-lite"
"2","Best captures the futuristic, high-tech, and multisensory vision requested for a 2050 airport experience.",1,4,1,11,"gemini-3.1-flash-lite"
"117","Strong narrative flow, though the technology described feels more like a near-future upgrade than 2050 innovation.",2,1,1,11,"gemini-3.1-flash-lite"
"95","Focuses too much on the protagonist's personal feelings rather than detailing the airport's innovative infrastructure.",3,3,1,11,"gemini-3.1-flash-lite"
"100","Weakest narrative; it reads like a generic business report rather than an immersive, futuristic travel story.",4,2,1,11,"gemini-3.1-flash-lite"
"52","Best balance of narrative storytelling, futuristic technology, and professional marketing slogans that fit the 2050 theme.",1,2,1,12,"gemini-3.1-flash-lite"
"18","Strong narrative flow and clear technological vision, though the slogans are slightly generic compared to Option B.",2,1,1,12,"gemini-3.1-flash-lite"
"88","Creative and evocative tone, but lacks specific technological details and fails to provide distinct, structured marketing slogans.",3,4,1,12,"gemini-3.1-flash-lite"
"25","Weakest structure; the writing style is informal and lacks the professional polish required for a high-tech airport proposal.",4,3,1,12,"gemini-3.1-flash-lite"
"11","Best alignment with the prompt; it captures the futuristic, high-tech, and innovative vision for 2050 perfectly.",1,1,1,13,"gemini-3.1-flash-lite"
"4","Good attempt, but the story lacks the creative, high-tech flair requested for a 2050 futuristic airport.",2,3,1,13,"gemini-3.1-flash-lite"
"19","Focuses on current-day technology rather than the requested futuristic 2050 vision; also lacks the required slogans.",3,4,1,13,"gemini-3.1-flash-lite"
"89","Completely irrelevant; it discusses Iceland travel tips instead of the required futuristic Tokyo airport design.",4,2,1,13,"gemini-3.1-flash-lite"
"26","Provides the most creative, detailed, and futuristic narrative that perfectly aligns with the 2050 vision requested.",1,4,1,14,"gemini-3.1-flash-lite"
"160","Strongly captures the futuristic theme and includes the required marketing slogans, though less narrative-driven than Option D.",2,3,1,14,"gemini-3.1-flash-lite"
"128","Well-written but lacks the truly futuristic, innovative, and high-tech elements required for a 2050 airport concept.",3,1,1,14,"gemini-3.1-flash-lite"
"118","Completely fails to address the prompt's requirements, focusing on generic vacation marketing rather than airport design.",4,2,1,14,"gemini-3.1-flash-lite"
"124","Best alignment with the futuristic, high-tech, and creative vision requested for the 2050 Tokyo airport experience.",1,4,1,15,"gemini-3.1-flash-lite"
"46","Strong focus on AI integration, though it lacks the imaginative, immersive storytelling requested for the traveler experience.",2,3,1,15,"gemini-3.1-flash-lite"
"77","Provides practical utility for remote workers but feels like a conventional airport upgrade rather than a futuristic vision.",3,2,1,15,"gemini-3.1-flash-lite"
"131","Describes personal travel preferences rather than proposing a futuristic airport experience for the design team.",4,1,1,15,"gemini-3.1-flash-lite"
"33","Provides the most comprehensive, realistic, and well-structured vision of a futuristic, eco-friendly, and seamless travel experience.",1,4,1,16,"gemini-3.1-flash-lite"
"30","Excellent narrative storytelling that effectively captures the emotional journey and sensory experience of a futuristic traveler.",2,1,1,16,"gemini-3.1-flash-lite"
"136","Focuses well on luxury and high-tech amenities but lacks the cohesive narrative flow found in the top options.",3,3,1,16,"gemini-3.1-flash-lite"
"80","The ideas are functional but presented as a generic list rather than a cohesive, immersive futuristic vision.",4,2,1,16,"gemini-3.1-flash-lite"
"8","Offers the most innovative, personalized, and immersive experience, perfectly aligning with the influencer's desire for cutting-edge technology.",1,3,1,17,"gemini-3.1-flash-lite"
"97","Provides a strong, sensory-focused narrative that emphasizes traveler well-being and sustainable energy, though less immersive than Option C.",2,4,1,17,"gemini-3.1-flash-lite"
"126","Covers essential futuristic infrastructure well, but feels more like a list of features than a compelling, cohesive traveler story.",3,2,1,17,"gemini-3.1-flash-lite"
"21","The experience is too utilitarian and lacks the creative, high-tech flair expected for a futuristic 2050 airport design.",4,1,1,17,"gemini-3.1-flash-lite"
"63","Captures the futuristic, high-tech, and immersive atmosphere requested while providing a creative narrative and engaging tone.",1,1,1,18,"gemini-3.1-flash-lite"
"76","Provides relevant futuristic concepts like AI and biometrics, though it lacks the narrative storytelling requested in the prompt.",2,2,1,18,"gemini-3.1-flash-lite"
"49","Offers good general travel insights but fails to describe a specific futuristic, high-tech airport experience for 2050.",3,4,1,18,"gemini-3.1-flash-lite"
"99","Describes standard, current-day airport procedures rather than a futuristic, innovative experience as requested by the prompt.",4,3,1,18,"gemini-3.1-flash-lite"
"125","Perfectly captures the futuristic, high-tech, and seamless experience requested for a 2050 Tokyo airport.",1,3,1,19,"gemini-3.1-flash-lite"
"40","Strong feature set, but lacks the narrative flow and immersive storytelling requested in the prompt.",2,1,1,19,"gemini-3.1-flash-lite"
"106","Focuses too much on standard airport logistics rather than the requested innovative, futuristic technology.",3,2,1,19,"gemini-3.1-flash-lite"
"61","Fails to address the futuristic 2050 theme, focusing instead on basic modern-day airport amenities.",4,4,1,19,"gemini-3.1-flash-lite"
"24","Perfectly captures the futuristic vision with creative, immersive details and professional marketing slogans.",1,4,1,20,"gemini-3.1-flash-lite"
"109","Provides a relatable narrative experience, though the marketing slogans are less sophisticated than Option D.",2,2,1,20,"gemini-3.1-flash-lite"
"140","Focuses on functional AI features but lacks the creative storytelling and marketing slogans required by the prompt.",3,3,1,20,"gemini-3.1-flash-lite"
"72","Fails to provide the required story and slogans, acting more like a generic blog post introduction.",4,1,1,20,"gemini-3.1-flash-lite"
"31","Best alignment with the futuristic, high-tech, and immersive experience requested for a 2050 Tokyo airport.",1,3,1,21,"gemini-3.1-flash-lite"
"43","Strong creative vision with the glass dome and biome, though slightly less focused on high-tech efficiency.",2,4,1,21,"gemini-3.1-flash-lite"
"90","Good focus on efficiency and personalized tech, but lacks the immersive, futuristic atmosphere of the top options.",3,1,1,21,"gemini-3.1-flash-lite"
"39","Too grounded in current airport improvements rather than the requested futuristic, innovative 2050 experience.",4,2,1,21,"gemini-3.1-flash-lite"
"120","Perfectly captures the futuristic, high-tech, and culturally integrated experience requested by the persona.",1,4,1,22,"gemini-3.1-flash-lite"
"98","Provides a solid, realistic vision of future airport automation, though less creative than Option D.",2,2,1,22,"gemini-3.1-flash-lite"
"105","The atmosphere feels sterile and slightly dystopian rather than an inviting, innovative travel experience.",3,1,1,22,"gemini-3.1-flash-lite"
"122","Focuses on unrealistic space travel rather than the requested airport service quality and design experience.",4,3,1,22,"gemini-3.1-flash-lite"
"91","Perfectly captures the futuristic, high-tech, and seamless experience requested by the influencer persona.",1,1,1,23,"gemini-3.1-flash-lite"
"93","Provides a creative narrative and slogans, though slightly less polished and visionary than Option A.",2,4,1,23,"gemini-3.1-flash-lite"
"62","Lacks a cohesive narrative story and instead reads like a generic list of airport features.",3,3,1,23,"gemini-3.1-flash-lite"
"7","Fails to meet the futuristic criteria, describing a standard, modern airport rather than a 2050 vision.",4,2,1,23,"gemini-3.1-flash-lite"
"119","Best narrative flow and creative vision that perfectly aligns with the futuristic 2050 airport theme.",1,1,1,24,"gemini-3.1-flash-lite"
"70","Strong focus on remote work needs, though the teleportation concept feels slightly disconnected from airport infrastructure.",2,2,1,24,"gemini-3.1-flash-lite"
"42","Good concepts, but the slogans are generic and lack the futuristic flair requested by the prompt.",3,4,1,24,"gemini-3.1-flash-lite"
"96","Fails to address the futuristic 2050 requirement, describing only current, mundane airport procedures instead.",4,3,1,24,"gemini-3.1-flash-lite"
"130","Captures the aesthetic and emotional essence of a futuristic Tokyo airport with vivid, immersive storytelling.",1,4,1,25,"gemini-3.1-flash-lite"
"71","Focuses on a unique, high-end passenger experience, though it lacks the technological depth of the other options.",2,2,1,25,"gemini-3.1-flash-lite"
"143","Provides a solid list of functional tech features but lacks the creative narrative flair required for the prompt.",3,1,1,25,"gemini-3.1-flash-lite"
"57","The writing style is disjointed and lacks the professional, visionary tone expected for a high-tech airport design.",4,3,1,25,"gemini-3.1-flash-lite"
"15","Perfectly aligns with the persona by balancing high-tech innovation with a clear, engaging narrative and catchy slogans.",1,1,1,26,"gemini-3.1-flash-lite"
"58","Strong focus on efficiency and technology, though it lacks the creative storytelling and slogans required by the prompt.",2,3,1,26,"gemini-3.1-flash-lite"
"142","Provides good practical examples, but focuses on past experiences rather than the requested futuristic 2050 vision.",3,4,1,26,"gemini-3.1-flash-lite"
"66","Fails to meet the prompt's requirement for a futuristic, high-tech focus, prioritizing nature over technological innovation.",4,2,1,26,"gemini-3.1-flash-lite"
"67","Best alignment with the futuristic, high-tech, and seamless travel experience requested for the 2050 Tokyo airport.",1,1,1,27,"gemini-3.1-flash-lite"
"86","Strong focus on AI and immersive cultural displays, though less comprehensive regarding the traveler's end-to-end logistics.",2,3,1,27,"gemini-3.1-flash-lite"
"87","Provides a solid list of standard airport amenities but lacks the futuristic, innovative vision required for 2050.",3,4,1,27,"gemini-3.1-flash-lite"
"51","Irrelevant personal anecdote about a past trip to Brazil; fails to address the futuristic airport design task.",4,2,1,27,"gemini-3.1-flash-lite"
"20","Best balance of creative futuristic technology and immersive, evocative storytelling that perfectly fits the influencer persona.",1,4,1,28,"gemini-3.1-flash-lite"
"135","Strong, professional, and realistic vision of future travel, though slightly less imaginative than Option D.",2,1,1,28,"gemini-3.1-flash-lite"
"81","Functional and clear, but the narrative style is too simplistic and lacks the high-tech flair requested.",3,2,1,28,"gemini-3.1-flash-lite"
"156","Too unrealistic and disjointed; the inclusion of a free gift card undermines the professional airport evaluation context.",4,3,1,28,"gemini-3.1-flash-lite"
"144","Best alignment with the futuristic 2050 vision, featuring holographic displays and AI-responsive systems for a seamless experience.",1,1,1,29,"gemini-3.1-flash-lite"
"60","Highly innovative concept with personal travel buddies and autonomous shuttles, though slightly less comprehensive than Option A.",2,3,1,29,"gemini-3.1-flash-lite"
"110","Good balance of AI and human interaction, but lacks the immersive high-tech atmosphere of the top two options.",3,4,1,29,"gemini-3.1-flash-lite"
"108","Too generic and relies on current-day technology like LED lights rather than truly futuristic 2050 innovations.",4,2,1,29,"gemini-3.1-flash-lite"
"29","Best alignment with the prompt's requirement for futuristic, innovative, and high-tech experiences for travelers.",1,1,1,30,"gemini-3.1-flash-lite"
"68","Good narrative style, but lacks the depth of futuristic technological innovation requested for the 2050 vision.",2,4,1,30,"gemini-3.1-flash-lite"
"123","Too generic and descriptive; fails to provide a creative, futuristic vision for a 2050 airport.",3,3,1,30,"gemini-3.1-flash-lite"
"155","Worst option; describes current, mundane airport procedures rather than a futuristic or innovative experience.",4,2,1,30,"gemini-3.1-flash-lite"
"101","Most innovative and creative concept; perfectly aligns with the futuristic, high-tech vision requested.",1,3,1,31,"gemini-3.1-flash-lite"
"23","Strong focus on personalized AI-driven experiences, though less imaginative than the virtual portal concept.",2,4,1,31,"gemini-3.1-flash-lite"
"59","Provides a clear narrative, but the technology described feels more like incremental improvement than futuristic innovation.",3,1,1,31,"gemini-3.1-flash-lite"
"3","Lacks a narrative story and focuses on basic modern conveniences rather than a truly futuristic experience.",4,2,1,31,"gemini-3.1-flash-lite"
"139","Offers the most immersive, futuristic, and personalized experience, perfectly aligning with the influencer's desire for cutting-edge innovation.",1,4,1,32,"gemini-3.1-flash-lite"
"84","Provides a highly practical and efficient vision of the future, focusing on seamless flow and minimalist design aesthetics.",2,3,1,32,"gemini-3.1-flash-lite"
"137","Focuses on convenience and personalized navigation, though it feels less transformative and futuristic than the top two options.",3,1,1,32,"gemini-3.1-flash-lite"
"153","Relies on dated concepts like flying car rentals, which feels less innovative compared to the advanced AI-driven concepts.",4,2,1,32,"gemini-3.1-flash-lite"
"134","Provides the most detailed, human-centric vision of luxury and convenience through the innovative Convini-Pods concept.",1,1,1,33,"gemini-3.1-flash-lite"
"1","Strong focus on sustainability and stress reduction, though it lacks the creative flair of the Convini-Pods.",2,4,1,33,"gemini-3.1-flash-lite"
"151","Practical automation ideas, but the slogans are generic and lack the futuristic punch required for this project.",3,3,1,33,"gemini-3.1-flash-lite"
"116","Teleportation is too sci-fi and ignores the airport experience, while the class-based discrimination is off-putting.",4,2,1,33,"gemini-3.1-flash-lite"
"22","Best captures the futuristic 2050 vision with creative elements like hyperloops, drones, and augmented reality integration.",1,2,1,34,"gemini-3.1-flash-lite"
"154","Strong focus on high-tech efficiency and modern amenities, though it feels more like an incremental upgrade than 2050.",2,4,1,34,"gemini-3.1-flash-lite"
"36","Practical and user-friendly, but lacks the imaginative, cutting-edge flair expected for a futuristic 2050 airport design.",3,1,1,34,"gemini-3.1-flash-lite"
"28","Too generic; it describes a standard modern airport rather than a high-tech, innovative experience for the year 2050.",4,3,1,34,"gemini-3.1-flash-lite"
"92","Perfectly captures the influencer persona with a focus on remote work, efficiency, and high-tech amenities.",1,2,1,35,"gemini-3.1-flash-lite"
"73","Strong narrative and creative use of VR, though slightly less focused on the professional remote work aspect.",2,1,1,35,"gemini-3.1-flash-lite"
"13","Lacks a cohesive narrative story and fails to provide the requested marketing slogans in a clear format.",3,3,1,35,"gemini-3.1-flash-lite"
"48","Missing the required marketing slogans entirely and the narrative feels more functional than futuristic or inspiring.",4,4,1,35,"gemini-3.1-flash-lite"
"129","Captures the futuristic, high-tech, and personalized experience requested while maintaining a strong, creative narrative flow.",1,4,1,36,"gemini-3.1-flash-lite"
"6","Provides a detailed, tech-forward vision of airport operations, though it feels slightly more mechanical than Option D.",2,2,1,36,"gemini-3.1-flash-lite"
"78","Focuses on efficiency but lacks the imaginative, futuristic flair required for a 2050 design concept.",3,1,1,36,"gemini-3.1-flash-lite"
"54","Offers generic travel advice rather than a futuristic airport experience, failing to meet the prompt's core requirements.",4,3,1,36,"gemini-3.1-flash-lite"
"9","Provides the most immersive, creative, and detailed narrative that perfectly aligns with the futuristic Tokyo 2050 vision.",1,3,1,37,"gemini-3.1-flash-lite"
"75","Offers creative and practical futuristic amenities like sleeping pods, though the narrative style is less engaging than Option C.",2,4,1,37,"gemini-3.1-flash-lite"
"150","Covers the core requirements well but lacks the descriptive depth and imaginative flair found in the top options.",3,2,1,37,"gemini-3.1-flash-lite"
"157","Fails to provide a cohesive story and relies on generic marketing language rather than a creative traveler experience.",4,1,1,37,"gemini-3.1-flash-lite"
"115","Best alignment with futuristic innovation and high-tech travel, offering a unique, creative solution for urban mobility.",1,4,1,38,"gemini-3.1-flash-lite"
"94","Strong focus on efficiency and remote work needs, though the technology described feels less futuristic than Option D.",2,1,1,38,"gemini-3.1-flash-lite"
"47","Provides a pleasant atmosphere, but lacks the high-tech, innovative edge required for a 2050 futuristic airport concept.",3,2,1,38,"gemini-3.1-flash-lite"
"141","Fails to meet the prompt's requirement for a futuristic story, instead describing current, often stressful, airport realities.",4,3,1,38,"gemini-3.1-flash-lite"
"74","Provides the most comprehensive, professional, and immersive narrative that perfectly aligns with the futuristic influencer persona.",1,4,1,39,"gemini-3.1-flash-lite"
"83","Strong narrative flow and creative use of technology, though slightly less polished in tone than Option D.",2,1,1,39,"gemini-3.1-flash-lite"
"127","Lacks the descriptive flair and immersive storytelling required to capture the futuristic, high-tech atmosphere effectively.",3,3,1,39,"gemini-3.1-flash-lite"
"38","Focuses too narrowly on a single mechanical solution, failing to capture the holistic, high-tech airport experience requested.",4,2,1,39,"gemini-3.1-flash-lite"
"5","Best alignment with the prompt; captures the futuristic, seamless, and high-tech atmosphere perfectly for a remote worker.",1,2,1,40,"gemini-3.1-flash-lite"
"158","Highly creative and futuristic, though the hoverboard concept feels slightly less professional than Option B.",2,3,1,40,"gemini-3.1-flash-lite"
"55","Engaging storytelling, but the Godzilla theme is more of a tourist attraction than a functional futuristic airport experience.",3,1,1,40,"gemini-3.1-flash-lite"
"111","Lacks the futuristic vision requested; the experience described is too mundane and resembles current airport services.",4,4,1,40,"gemini-3.1-flash-lite"
"31","Best alignment with the futuristic 2050 theme, focusing on immersive VR, AR, and seamless AI-driven luxury experiences.",1,4,2,1,"gemini-3.1-flash-lite"
"134","Strong practical focus on traveler comfort and innovative 'Convini-Pods', though slightly less visionary than Option D.",2,1,2,1,"gemini-3.1-flash-lite"
"94","Good narrative flow, but the lack of security screening is unrealistic for a high-tech airport concept.",3,3,2,1,"gemini-3.1-flash-lite"
"25","Weakest narrative structure; it reads more like a list of features than a cohesive futuristic travel story.",4,2,2,1,"gemini-3.1-flash-lite"
"18","Perfectly captures the persona's narrative style and includes all required elements with high creative quality.",1,3,2,2,"gemini-3.1-flash-lite"
"24","Strong narrative and clear slogans, though slightly less immersive than Option C in its storytelling approach.",2,2,2,2,"gemini-3.1-flash-lite"
