"item_id","reason","rank","presentation_pos","REP","IBLOCK","MODEL"
"122","The content is unrealistic and reads like a generic sales advertisement rather than a professional design proposal.",4,4,11,17,"gemini-3.1-flash-lite"
"9","Best narrative quality; perfectly captures the futuristic, immersive, and high-tech vision requested by the influencer persona.",1,2,11,18,"gemini-3.1-flash-lite"
"6","Strong focus on operational efficiency and modern convenience, though it lacks the creative flair of Option B.",2,4,11,18,"gemini-3.1-flash-lite"
"127","Functional and clear, but the reliance on robot assistants feels less innovative than the immersive tech in Option B.",3,1,11,18,"gemini-3.1-flash-lite"
"100","Weakest narrative; focuses too much on basic language accessibility rather than the requested futuristic, high-tech experience.",4,3,11,18,"gemini-3.1-flash-lite"
"5","Perfectly captures the futuristic, immersive, and high-tech atmosphere requested while providing creative, well-structured marketing slogans.",1,1,11,19,"gemini-3.1-flash-lite"
"157","Strong focus on AI and innovation, though the slogans are less professional and catchy than Option A.",2,4,11,19,"gemini-3.1-flash-lite"
"60","Creative concept with the travel buddy, but lacks the professional tone and missing the required marketing slogans.",3,2,11,19,"gemini-3.1-flash-lite"
"87","Too generic and descriptive; it lacks the futuristic, high-tech storytelling and marketing slogans required by the prompt.",4,3,11,19,"gemini-3.1-flash-lite"
"119","Perfectly aligns with the futuristic 2050 vision, providing both the required story and catchy marketing slogans.",1,3,11,20,"gemini-3.1-flash-lite"
"57","Offers creative futuristic concepts like AI-managed aircraft, but lacks the requested story and slogan structure.",2,1,11,20,"gemini-3.1-flash-lite"
"10","Provides practical service improvements but fails to capture the high-tech, futuristic atmosphere requested for 2050.",3,4,11,20,"gemini-3.1-flash-lite"
"54","Contains generic travel advice rather than innovative, futuristic airport design concepts for the year 2050.",4,2,11,20,"gemini-3.1-flash-lite"
"73","Best alignment with the prompt; provides a creative, immersive narrative and three distinct, catchy marketing slogans.",1,2,11,21,"gemini-3.1-flash-lite"
"43","Good futuristic imagery, but the slogans are integrated poorly and lack the professional marketing polish of Option B.",2,3,11,21,"gemini-3.1-flash-lite"
"140","Focuses on current technology rather than a 2050 vision and fails to provide the requested marketing slogans.",3,1,11,21,"gemini-3.1-flash-lite"
"123","Fails to address the futuristic 2050 theme, lacks a creative story, and provides no marketing slogans.",4,4,11,21,"gemini-3.1-flash-lite"
"143","Captures the influencer persona perfectly by highlighting social media appeal and immersive, high-tech, eco-friendly experiences.",1,3,11,22,"gemini-3.1-flash-lite"
"13","Strong focus on efficiency and VR entertainment, though the narrative style is less creative than Option C.",2,1,11,22,"gemini-3.1-flash-lite"
"34","Provides practical, innovative utility features, but lacks the cohesive storytelling and visionary tone requested.",3,4,11,22,"gemini-3.1-flash-lite"
"95","The narrative is too focused on minor details and fails to provide the requested three distinct marketing slogans.",4,2,11,22,"gemini-3.1-flash-lite"
"56","Comprehensive, visionary, and perfectly captures the futuristic, high-tech, and sustainable essence requested for the 2050 Tokyo airport.",1,4,11,23,"gemini-3.1-flash-lite"
"114","Strong narrative flow and creative imagery, though slightly less detailed regarding infrastructure than Option D.",2,3,11,23,"gemini-3.1-flash-lite"
"31","Good focus on technology, but the narrative is less immersive and descriptive than the top two options.",3,1,11,23,"gemini-3.1-flash-lite"
"78","Fails to meet the futuristic 2050 criteria, focusing instead on generic modern airport features and mentioning Kyoto.",4,2,11,23,"gemini-3.1-flash-lite"
"139","Offers the most immersive, futuristic, and personalized experience through holographic assistants and customizable environments.",1,4,11,24,"gemini-3.1-flash-lite"
"45","Strong focus on seamless biometric integration and hyperloop connectivity, though less personalized than Option D.",2,2,11,24,"gemini-3.1-flash-lite"
"14","Practical and useful for comfort, but lacks the high-tech, innovative flair requested for a 2050 vision.",3,1,11,24,"gemini-3.1-flash-lite"
"49","Too generic and lacks specific, creative technological solutions compared to the other futuristic proposals.",4,3,11,24,"gemini-3.1-flash-lite"
"48","Best narrative flow; it effectively captures the futuristic, stress-free, and high-tech experience requested by the persona.",1,4,11,25,"gemini-3.1-flash-lite"
"40","Strong technical vision, but lacks the requested narrative story format and cohesive marketing slogans.",2,3,11,25,"gemini-3.1-flash-lite"
"47","Includes a story and slogans, but the experience feels more like a modern mall than a futuristic 2050 airport.",3,1,11,25,"gemini-3.1-flash-lite"
"72","Fails to provide the requested creative story, instead offering a generic list of features and influencer-style filler text.",4,2,11,25,"gemini-3.1-flash-lite"
"117","Perfectly balances futuristic technology with human-centric design, creating the most immersive and realistic traveler experience.",1,2,11,26,"gemini-3.1-flash-lite"
"148","Strong focus on high-tech features, but the tone feels more like a corporate advertisement than a personal story.",2,1,11,26,"gemini-3.1-flash-lite"
"66","Provides a unique perspective on nature, but fails to include the required marketing slogans for the second part.",3,3,11,26,"gemini-3.1-flash-lite"
"46","Lacks a narrative story and creative marketing slogans, focusing only on abstract concepts rather than the traveler experience.",4,4,11,26,"gemini-3.1-flash-lite"
"112","Perfectly captures the high-tech, efficient, and personalized experience requested for a futuristic 2050 travel scenario.",1,4,11,27,"gemini-3.1-flash-lite"
"103","Strong visual storytelling and creative integration of sustainable technology and robotics, though lacks specific marketing slogans.",2,2,11,27,"gemini-3.1-flash-lite"
"158","Creative and fast-paced, but the slogans are generic and lack the professional polish expected for a futuristic brand.",3,1,11,27,"gemini-3.1-flash-lite"
"37","Fails the prompt by describing a past experience rather than a futuristic, innovative vision for the year 2050.",4,3,11,27,"gemini-3.1-flash-lite"
"92","Perfectly aligns with the influencer persona by emphasizing remote work, high-tech efficiency, and seamless travel experiences.",1,1,11,28,"gemini-3.1-flash-lite"
"35","Highly innovative and futuristic, though slightly less focused on the professional remote work aspect than Option A.",2,3,11,28,"gemini-3.1-flash-lite"
"147","Good cultural integration, but lacks the depth of specific technological innovation requested for a 2050 futuristic airport.",3,4,11,28,"gemini-3.1-flash-lite"
"79","Too focused on nature and basic service rather than the cutting-edge technology and futuristic innovation requested.",4,2,11,28,"gemini-3.1-flash-lite"
"144","Best alignment with the futuristic, high-tech, and seamless experience requested for a 2050 Tokyo airport.",1,3,11,29,"gemini-3.1-flash-lite"
"84","Strong focus on efficiency and minimalist design, though it lacks the immersive technological wonder of Option C.",2,2,11,29,"gemini-3.1-flash-lite"
"23","Good focus on personalization, but the features feel less revolutionary and more like current high-end airport amenities.",3,4,11,29,"gemini-3.1-flash-lite"
"159","Too focused on conventional amenities like dog parks and pools rather than innovative, futuristic travel technology.",4,1,11,29,"gemini-3.1-flash-lite"
"91","Perfectly captures the futuristic, high-tech vision requested with specific, creative examples like holographic guides and hyperloop transport.",1,4,11,30,"gemini-3.1-flash-lite"
"70","Highly creative concept of teleportation, though it leans more into science fiction than a realistic airport design experience.",2,3,11,30,"gemini-3.1-flash-lite"
"58","Focuses on practical efficiency and biometrics, but lacks the imaginative, futuristic flair expected for a 2050 design.",3,1,11,30,"gemini-3.1-flash-lite"
"28","Fails to address the high-tech, futuristic requirement, focusing instead on traditional amenities like parks and food courts.",4,2,11,30,"gemini-3.1-flash-lite"
"75","Offers the most comprehensive and creative vision of futuristic airport amenities like VR pods and AI-driven mobility.",1,1,11,31,"gemini-3.1-flash-lite"
"115","Innovative concept of aerial transit capsules, though the narrative is less detailed than Option A.",2,2,11,31,"gemini-3.1-flash-lite"
"109","Relatable narrative, but the futuristic elements are limited compared to the advanced automation in other options.",3,3,11,31,"gemini-3.1-flash-lite"
"21","Lacks a cohesive story structure and the slogans are generic compared to the other creative proposals.",4,4,11,31,"gemini-3.1-flash-lite"
"41","Best alignment with the persona, incorporating AR, drone service, and a vivid narrative of a futuristic experience.",1,2,11,32,"gemini-3.1-flash-lite"
"65","Strong futuristic vision, but lacks the requested three catchy marketing slogans in the final output.",2,1,11,32,"gemini-3.1-flash-lite"
"99","Fails to address the futuristic 2050 theme, providing only generic, outdated airport travel instructions.",3,3,11,32,"gemini-3.1-flash-lite"
"51","Completely irrelevant to the prompt; it describes a personal childhood trip to Brazil instead of a futuristic airport.",4,4,11,32,"gemini-3.1-flash-lite"
"2","Best alignment with the prompt; it creates a vivid, multisensory, and futuristic narrative fitting the influencer persona.",1,1,11,33,"gemini-3.1-flash-lite"
"107","Strong practical focus on high-tech automation, though the narrative style is less immersive than Option A.",2,3,11,33,"gemini-3.1-flash-lite"
"94","Good focus on convenience, but the futuristic elements feel less innovative compared to the bio-domes in Option A.",3,4,11,33,"gemini-3.1-flash-lite"
"29","Weakest because it lacks a cohesive narrative story and reads more like a list of random suggestions.",4,2,11,33,"gemini-3.1-flash-lite"
"97","Best alignment with the futuristic, high-tech, and personalized experience requested for a 2050 Tokyo airport.",1,3,11,34,"gemini-3.1-flash-lite"
"116","Highly creative and futuristic concept, though it lacks the human-centric warmth expected in high-end design.",2,4,11,34,"gemini-3.1-flash-lite"
"146","Professional and pleasant, but relies on current-day amenities rather than truly innovative 2050 technology.",3,2,11,34,"gemini-3.1-flash-lite"
"152","Too generic and focuses on security procedures rather than the innovative, futuristic traveler experience requested.",4,1,11,34,"gemini-3.1-flash-lite"
"138","Best alignment with the prompt by detailing futuristic AI and biometric technology in a creative narrative.",1,2,11,35,"gemini-3.1-flash-lite"
"68","Good narrative structure, but lacks the depth of high-tech innovation requested for a 2050 airport.",2,3,11,35,"gemini-3.1-flash-lite"
"128","Too generic; describes a modern airport rather than a futuristic, innovative 2050 experience.",3,1,11,35,"gemini-3.1-flash-lite"
"96","Worst; provides standard, outdated airport instructions instead of the requested futuristic creative story.",4,4,11,35,"gemini-3.1-flash-lite"
"98","Best alignment with the futuristic, high-tech, and influencer-focused vision through drone delivery and VR entertainment.",1,2,11,36,"gemini-3.1-flash-lite"
"102","Strong focus on efficiency and biometric security, though slightly less creative than Option B regarding passenger experience.",2,3,11,36,"gemini-3.1-flash-lite"
"151","Includes innovative mobility features like scooters, but the description feels more utilitarian than a premium futuristic experience.",3,1,11,36,"gemini-3.1-flash-lite"
"7","Lacks the high-tech, futuristic innovation requested, focusing instead on basic cleanliness and standard airport amenities.",4,4,11,36,"gemini-3.1-flash-lite"
"125","Provides the most immersive, innovative, and sensory-rich narrative that perfectly aligns with a futuristic travel experience.",1,3,11,37,"gemini-3.1-flash-lite"
"52","Strong narrative structure and includes creative elements like the Hyperloop, though slightly less descriptive than Option C.",2,1,11,37,"gemini-3.1-flash-lite"
"150","Functional and clear, but the writing style is too casual and lacks the professional polish of the top options.",3,2,11,37,"gemini-3.1-flash-lite"
"110","Lacks the high-tech, futuristic flair requested, relying too heavily on human interaction rather than innovative technology.",4,4,11,37,"gemini-3.1-flash-lite"
"24","Perfectly aligns with the prompt by providing both a detailed futuristic story and three catchy marketing slogans.",1,3,11,38,"gemini-3.1-flash-lite"
"149","Provides a clear, creative vision of the future but fails to include the required marketing slogans.",2,1,11,38,"gemini-3.1-flash-lite"
"106","Focuses too much on logistical traffic flow rather than the innovative, high-tech experience requested by the persona.",3,4,11,38,"gemini-3.1-flash-lite"
"133","Too abstract and vague; it lacks concrete descriptions of futuristic technology or specific airport services.",4,2,11,38,"gemini-3.1-flash-lite"
"18","Perfectly captures the creative, futuristic narrative and specific marketing slogans requested in the prompt.",1,4,11,39,"gemini-3.1-flash-lite"
"104","Strong technical vision for 2050, though it lacks the personal storytelling element requested in the prompt.",2,3,11,39,"gemini-3.1-flash-lite"
"3","Focuses on current-day improvements rather than the requested futuristic, innovative 2050 experience.",3,1,11,39,"gemini-3.1-flash-lite"
"131","Fails to address the prompt's requirement to design an airport experience, focusing instead on personal biography.",4,2,11,39,"gemini-3.1-flash-lite"
"33","Provides the most comprehensive and professional vision of a seamless, tech-integrated, and sustainable futuristic airport experience.",1,2,11,40,"gemini-3.1-flash-lite"
"82","Offers a unique, creative focus on cultural immersion and destination preparation, distinguishing it from purely functional tech descriptions.",2,4,11,40,"gemini-3.1-flash-lite"
"160","Includes engaging ideas like VR at gates, but the writing style is less professional and lacks structural polish.",3,3,11,40,"gemini-3.1-flash-lite"
"88","Too abstract and vague; it lacks concrete technological details or a clear vision of the actual airport experience.",4,1,11,40,"gemini-3.1-flash-lite"
"125","Provides the most cohesive, innovative, and descriptive vision of a futuristic, seamless, and stress-free travel experience.",1,3,12,1,"gemini-3.1-flash-lite"
"147","Successfully blends traditional Japanese culture with futuristic technology, creating a unique and immersive atmosphere.",2,4,12,1,"gemini-3.1-flash-lite"
"160","Focuses well on practical high-tech solutions like facial recognition, but the narrative flow is less engaging.",3,2,12,1,"gemini-3.1-flash-lite"
"158","The narrative feels chaotic and lacks the professional, sophisticated tone expected for a world-renowned design team.",4,1,12,1,"gemini-3.1-flash-lite"
"4","Provides a clear, structured narrative of a futuristic airport experience that aligns perfectly with the prompt requirements.",1,1,12,2,"gemini-3.1-flash-lite"
"88","Captures the futuristic atmosphere well but fails to provide the required marketing slogans for the second part.",2,4,12,2,"gemini-3.1-flash-lite"
"14","Focuses too narrowly on capsule hotels rather than the holistic, high-tech airport experience requested by the prompt.",3,3,12,2,"gemini-3.1-flash-lite"
"118","Completely irrelevant to the airport context and fails to address the specific futuristic design requirements.",4,2,12,2,"gemini-3.1-flash-lite"
"40","Offers the most comprehensive and innovative technological suite, perfectly aligning with the futuristic 2050 vision.",1,4,12,3,"gemini-3.1-flash-lite"
"45","Strong focus on immersive environmental design and seamless connectivity, though less detailed than Option D.",2,3,12,3,"gemini-3.1-flash-lite"
"126","Provides a solid, well-rounded airport experience, but lacks the creative flair of the top two options.",3,2,12,3,"gemini-3.1-flash-lite"
"10","Too focused on minor logistical improvements rather than the transformative, high-tech experience requested for 2050.",4,1,12,3,"gemini-3.1-flash-lite"
"48","Provides the most cohesive, immersive narrative of a seamless, high-tech 2050 travel experience.",1,4,12,4,"gemini-3.1-flash-lite"
"115","Offers a creative vision of aerial mobility, though the narrative flow is less polished than Option D.",2,3,12,4,"gemini-3.1-flash-lite"
"153","Focuses well on futuristic utility but lacks a compelling narrative story structure.",3,2,12,4,"gemini-3.1-flash-lite"
"12","The writing is repetitive and lacks the futuristic, high-tech innovation required by the prompt.",4,1,12,4,"gemini-3.1-flash-lite"
"83","Provides the most comprehensive and immersive narrative while adhering perfectly to all formatting and word count constraints.",1,4,12,5,"gemini-3.1-flash-lite"
"15","Strong narrative flow and professional tone, though slightly less detailed than Option D regarding specific user interactions.",2,1,12,5,"gemini-3.1-flash-lite"
"27","Good technical focus, but the slogans are generic and lack the creative flair expected for a futuristic airport.",3,2,12,5,"gemini-3.1-flash-lite"
"44","Lacks the required structure and depth, failing to meet the professional standard of the other submissions.",4,3,12,5,"gemini-3.1-flash-lite"
"11","Best alignment with the prompt by detailing specific, innovative, high-tech solutions for a futuristic 2050 airport experience.",1,2,12,6,"gemini-3.1-flash-lite"
"146","Good focus on traveler comfort and aesthetics, but lacks the specific high-tech innovation requested for a 2050 vision.",2,1,12,6,"gemini-3.1-flash-lite"
"79","Focuses on nature rather than the requested cutting-edge technology, and fails to provide the required marketing slogans.",3,3,12,6,"gemini-3.1-flash-lite"
"53","Irrelevant content; describes a hotel experience rather than the airport experience requested in the prompt.",4,4,12,6,"gemini-3.1-flash-lite"
"35","Perfectly captures the futuristic, frictionless, and high-tech vision requested for a 2050 Tokyo airport experience.",1,1,12,7,"gemini-3.1-flash-lite"
"67","Provides a practical, user-centric flow, though it relies on current-day technology rather than true 2050 innovation.",2,3,12,7,"gemini-3.1-flash-lite"
"102","Offers a comprehensive list of features but lacks the immersive storytelling and creative flair requested.",3,4,12,7,"gemini-3.1-flash-lite"
"105","The atmosphere feels sterile and dystopian rather than an innovative, high-tech, and welcoming travel experience.",4,2,12,7,"gemini-3.1-flash-lite"
"97","Best alignment with the 2050 futuristic theme, incorporating AI, AR, and sustainable energy for a premium experience.",1,4,12,8,"gemini-3.1-flash-lite"
"95","Strong narrative focus on the traveler's emotional journey and the integration of humanoid robotics.",2,2,12,8,"gemini-3.1-flash-lite"
"3","Focuses on practical efficiency, but lacks the creative, high-tech flair expected for a 2050 futuristic airport.",3,3,12,8,"gemini-3.1-flash-lite"
"28","Weakest option; describes a standard modern mall experience rather than a truly innovative or futuristic airport.",4,1,12,8,"gemini-3.1-flash-lite"
"144","Best alignment with the futuristic, high-tech, and innovative vision requested for a 2050 Tokyo airport experience.",1,2,12,9,"gemini-3.1-flash-lite"
"129","Creative and immersive narrative, though slightly less focused on the broad technological infrastructure than Option B.",2,4,12,9,"gemini-3.1-flash-lite"
"19","Good focus on biometric technology, but the narrative is too grounded in current tech rather than 2050 innovation.",3,3,12,9,"gemini-3.1-flash-lite"
"7","Lacks the futuristic, high-tech, and innovative elements required by the prompt, feeling like a standard modern airport.",4,1,12,9,"gemini-3.1-flash-lite"
"9","Best narrative quality; perfectly captures the futuristic, immersive, and high-tech vision requested by the design team.",1,3,12,10,"gemini-3.1-flash-lite"
"76","Strong focus on functional AI and robotics, though the narrative lacks the creative flair of Option C.",2,2,12,10,"gemini-3.1-flash-lite"
"13","Provides a clear, efficient vision but relies on generic descriptions rather than a compelling, immersive story.",3,1,12,10,"gemini-3.1-flash-lite"
"55","Focuses too heavily on a single gimmick rather than the comprehensive, high-tech airport experience requested.",4,4,12,10,"gemini-3.1-flash-lite"
"56","Perfectly aligns with the futuristic 2050 theme by integrating advanced tech like AI, Hyperloop, and VR.",1,2,12,11,"gemini-3.1-flash-lite"
"66","Offers a unique, creative vision of balancing high-tech with nature, though lacks specific marketing slogans.",2,4,12,11,"gemini-3.1-flash-lite"
"145","Focuses on practical efficiency and cultural immersion, but feels more like a modern upgrade than futuristic.",3,3,12,11,"gemini-3.1-flash-lite"
"111","The vision is too simplistic and relies on basic robotics rather than truly innovative 2050 technology.",4,1,12,11,"gemini-3.1-flash-lite"
"32","Perfectly fulfills all requirements, including the creative story and catchy slogans, capturing the futuristic vision requested.",1,3,12,12,"gemini-3.1-flash-lite"
"128","Provides a coherent and professional tone, though it lacks the specific creative futuristic elements requested in the prompt.",2,2,12,12,"gemini-3.1-flash-lite"
"57","Offers relevant ideas but suffers from poor grammar and lacks the requested structure of a story and slogans.",3,4,12,12,"gemini-3.1-flash-lite"
"17","Fails to address the futuristic technology aspect, focusing instead on exclusionary travel practices that ignore the prompt's context.",4,1,12,12,"gemini-3.1-flash-lite"
"148","Provides a comprehensive, creative narrative and slogans that perfectly align with the futuristic 2050 vision requested.",1,4,12,13,"gemini-3.1-flash-lite"
"60","Offers a strong, personalized user experience narrative, though it lacks the requested marketing slogans.",2,3,12,13,"gemini-3.1-flash-lite"
"159","Focuses on current-day amenities rather than innovative, futuristic technology suitable for a 2050 design concept.",3,1,12,13,"gemini-3.1-flash-lite"
"64","Fails to provide the required narrative story and focuses on unrealistic logistics rather than traveler experience.",4,2,12,13,"gemini-3.1-flash-lite"
"18","Excellent narrative flow and creative use of futuristic technology like floating luggage and AR glasses.",1,2,12,14,"gemini-3.1-flash-lite"
"114","Strong futuristic vision, though the virtual reality teleportation concept feels slightly less grounded than Option B.",2,4,12,14,"gemini-3.1-flash-lite"
"98","Functional and realistic, but relies too heavily on current-day concepts like phone apps and kiosks.",3,1,12,14,"gemini-3.1-flash-lite"
"89","Completely irrelevant to the prompt as it discusses Iceland travel tips instead of a futuristic airport.",4,3,12,14,"gemini-3.1-flash-lite"
"140","Best alignment with the futuristic 2050 vision, focusing on AI integration and seamless automated service for remote workers.",1,1,12,15,"gemini-3.1-flash-lite"
"142","Strong practical focus on tech-enabled comfort, though it describes an existing airport rather than a 2050 vision.",2,4,12,15,"gemini-3.1-flash-lite"
"29","Creative ideas for leisure, but lacks the professional, high-tech infrastructure focus required for a futuristic airport design.",3,3,12,15,"gemini-3.1-flash-lite"
"99","Worst option; it describes standard, outdated airport procedures rather than a futuristic or innovative travel experience.",4,2,12,15,"gemini-3.1-flash-lite"
"91","Best integration of futuristic tech like Hyperloop and VR, perfectly matching the influencer's innovative and high-tech travel persona.",1,4,12,16,"gemini-3.1-flash-lite"
"74","Strong focus on seamless, stress-free travel with practical high-tech solutions, though slightly less imaginative than Option D.",2,3,12,16,"gemini-3.1-flash-lite"
"139","Creative use of holographic environments, but the reliance on robotic helpers feels less sophisticated than the other options.",3,1,12,16,"gemini-3.1-flash-lite"
"157","Weakest narrative; it relies on generic buzzwords and lacks the immersive, descriptive storytelling found in the other options.",4,2,12,16,"gemini-3.1-flash-lite"
"5","Perfectly captures the requested futuristic, high-tech, and emotional traveler experience with professional, creative slogans.",1,4,12,17,"gemini-3.1-flash-lite"
"75","Strong creative vision for 2050, though it lacks the required marketing slogans for the second part.",2,3,12,17,"gemini-3.1-flash-lite"
"151","Includes functional ideas but lacks a narrative story and feels more like a list of features.",3,2,12,17,"gemini-3.1-flash-lite"
"68","Fails to meet the futuristic criteria, describing a standard modern airport experience rather than 2050 innovation.",4,1,12,17,"gemini-3.1-flash-lite"
"73","Perfectly captures the futuristic, high-tech, and personalized experience requested while including creative marketing slogans.",1,1,12,18,"gemini-3.1-flash-lite"
"2","Strong focus on multisensory futuristic technology, though it lacks the required marketing slogans for the second part.",2,2,12,18,"gemini-3.1-flash-lite"
"78","Focuses on efficiency but lacks the imaginative, futuristic flair and high-tech innovation requested for the year 2050.",3,4,12,18,"gemini-3.1-flash-lite"
