"item_id","reason","rank","presentation_pos","REP","IBLOCK","MODEL"
"137","Too grounded in current technology; lacks the visionary, futuristic innovation expected for a 2050 airport design.",4,4,15,22,"gemini-3.1-flash-lite"
"67","Best alignment with the prompt's focus on high-tech, seamless, and innovative remote-work travel experiences.",1,1,15,23,"gemini-3.1-flash-lite"
"71","Strong focus on luxury and futuristic service, though slightly less tech-centric than Option A.",2,4,15,23,"gemini-3.1-flash-lite"
"159","Offers creative amenities like VR, but feels more like a traditional mall than a futuristic airport.",3,2,15,23,"gemini-3.1-flash-lite"
"128","Too generic and lacks the specific, creative futuristic details requested for a 2050 airport design.",4,3,15,23,"gemini-3.1-flash-lite"
"101","The virtual portal concept perfectly aligns with my desire for innovative, high-tech travel experiences.",1,1,15,24,"gemini-3.1-flash-lite"
"22","Strong integration of futuristic infrastructure like hyperloops and AR, though slightly less focused than Option A.",2,4,15,24,"gemini-3.1-flash-lite"
"88","Offers a compelling aesthetic vision but lacks the specific functional technological features I prioritize.",3,2,15,24,"gemini-3.1-flash-lite"
"77","Too generic; it describes a standard luxury airport rather than the futuristic, innovative experience requested.",4,3,15,24,"gemini-3.1-flash-lite"
"120","Perfectly balances high-tech innovation with Japanese cultural aesthetics, creating a truly immersive and futuristic traveler experience.",1,2,15,25,"gemini-3.1-flash-lite"
"82","Focuses uniquely on the emotional and cultural preparation of the traveler, offering a creative, experiential approach to transit.",2,4,15,25,"gemini-3.1-flash-lite"
"154","Provides a solid, functional overview of futuristic amenities, though it lacks the creative flair of the top options.",3,3,15,25,"gemini-3.1-flash-lite"
"157","Relies too heavily on generic buzzwords and lacks the specific, vivid imagery required for a futuristic design concept.",4,1,15,25,"gemini-3.1-flash-lite"
"98","Best alignment with the prompt by providing both a detailed futuristic narrative and catchy marketing slogans.",1,4,15,26,"gemini-3.1-flash-lite"
"10","Strong practical focus on traveler pain points, though it lacks the requested creative futuristic narrative.",2,1,15,26,"gemini-3.1-flash-lite"
"25","Captures the futuristic spirit well but lacks a cohesive narrative structure and professional presentation.",3,3,15,26,"gemini-3.1-flash-lite"
"68","Weakest entry as it fails to incorporate high-tech innovation, focusing instead on basic travel experiences.",4,2,15,26,"gemini-3.1-flash-lite"
"24","Provides the most immersive, descriptive narrative that perfectly captures the futuristic, high-tech, and serene traveler experience requested.",1,2,15,27,"gemini-3.1-flash-lite"
"147","Strong creative vision blending traditional Japanese culture with futuristic technology, though slightly less detailed than Option B.",2,4,15,27,"gemini-3.1-flash-lite"
"126","Functional and comprehensive list of features, but lacks the narrative storytelling flair required by the prompt.",3,3,15,27,"gemini-3.1-flash-lite"
"76","The narrative is too brief and lacks the creative, futuristic atmosphere compared to the other options.",4,1,15,27,"gemini-3.1-flash-lite"
"32","Best alignment with the futuristic 2050 theme, incorporating creative technologies like teleportation and anti-gravity chambers.",1,1,15,28,"gemini-3.1-flash-lite"
"129","Strong focus on passenger comfort and stress reduction, though the technology feels slightly less advanced than Option A.",2,2,15,28,"gemini-3.1-flash-lite"
"150","Provides a clear, logical flow of the airport experience but lacks the imaginative flair of the top options.",3,3,15,28,"gemini-3.1-flash-lite"
"12","Weakest narrative structure and fails to provide the requested catchy marketing slogans in the specified format.",4,4,15,28,"gemini-3.1-flash-lite"
"20","Provides the most vivid, creative, and comprehensive narrative that perfectly captures the futuristic Tokyo 2050 vision.",1,3,15,29,"gemini-3.1-flash-lite"
"8","Strong focus on personalized AI-driven experiences, though it lacks the descriptive world-building found in the top option.",2,1,15,29,"gemini-3.1-flash-lite"
"2","Good imagery with bio-domes, but the narrative is too brief and lacks the depth of the higher-ranked options.",3,4,15,29,"gemini-3.1-flash-lite"
"136","Too focused on generic luxury features rather than a cohesive, immersive futuristic story as requested by the prompt.",4,2,15,29,"gemini-3.1-flash-lite"
"16","Best alignment with the 2050 futuristic theme, incorporating advanced technology like VR and autonomous transit.",1,1,15,30,"gemini-3.1-flash-lite"
"84","Strong focus on efficiency and aesthetics, though slightly less imaginative regarding future technology than Option A.",2,3,15,30,"gemini-3.1-flash-lite"
"49","Addresses traveler pain points well but lacks the specific futuristic, high-tech vision requested for 2050.",3,4,15,30,"gemini-3.1-flash-lite"
"61","Focuses on current-day amenities like bean bags and outlets rather than the requested futuristic 2050 vision.",4,2,15,30,"gemini-3.1-flash-lite"
"74","Provides the most comprehensive, innovative vision of 2050 technology while perfectly adhering to all task requirements.",1,4,15,31,"gemini-3.1-flash-lite"
"5","Strong narrative and effective slogans, though slightly less detailed regarding futuristic infrastructure than Option D.",2,3,15,31,"gemini-3.1-flash-lite"
"117","Good descriptive story, but failed to provide the required marketing slogans requested in the prompt.",3,1,15,31,"gemini-3.1-flash-lite"
"99","Completely fails the prompt as it describes standard, current-day airport procedures rather than a futuristic 2050 experience.",4,2,15,31,"gemini-3.1-flash-lite"
"31","Perfectly aligns with the 2050 futuristic theme, emphasizing AI, biometrics, and immersive AR/VR experiences.",1,4,15,32,"gemini-3.1-flash-lite"
"116","Highly creative use of teleportation technology, though it lacks the grounded luxury feel of the other options.",2,3,15,32,"gemini-3.1-flash-lite"
"142","Focuses on practical, existing technology rather than the requested futuristic 2050 vision.",3,1,15,32,"gemini-3.1-flash-lite"
"28","Lacks any significant technological innovation, reading more like a traditional airport brochure than a futuristic concept.",4,2,15,32,"gemini-3.1-flash-lite"
"102","Provides a comprehensive, structured vision of futuristic airport infrastructure and passenger services aligned with the prompt.",1,2,15,33,"gemini-3.1-flash-lite"
"46","Focuses well on AI integration and efficiency, though it lacks the descriptive narrative depth of Option B.",2,3,15,33,"gemini-3.1-flash-lite"
"57","Includes creative ideas like robotic maintenance, but the writing style is disjointed and lacks professional polish.",3,1,15,33,"gemini-3.1-flash-lite"
"51","Completely irrelevant to the prompt as it describes a personal childhood travel anecdote rather than airport design.",4,4,15,33,"gemini-3.1-flash-lite"
"134","Best alignment with the prompt; provides a creative, futuristic vision of Tokyo 2050 with specific, innovative concepts.",1,1,15,34,"gemini-3.1-flash-lite"
"37","Good narrative flow and includes relevant slogans, though it focuses more on current tech than futuristic 2050 concepts.",2,4,15,34,"gemini-3.1-flash-lite"
"152","Lacks the requested creative storytelling and relies on generic descriptions rather than a cohesive futuristic vision.",3,3,15,34,"gemini-3.1-flash-lite"
"118","Worst submission; it is a collection of unrelated marketing phrases that fails to address the airport design prompt.",4,2,15,34,"gemini-3.1-flash-lite"
"92","Perfectly captures the futuristic, high-tech, and remote-work-focused persona requested in the prompt with excellent creative storytelling.",1,2,15,35,"gemini-3.1-flash-lite"
"127","Addresses the prompt requirements well, though the narrative is less descriptive and immersive than Option B.",2,4,15,35,"gemini-3.1-flash-lite"
"141","Fails to provide a futuristic story or specific marketing slogans, focusing instead on general current airport experiences.",3,3,15,35,"gemini-3.1-flash-lite"
"131","Completely ignores the task of writing a story about a futuristic airport and creating marketing slogans.",4,1,15,35,"gemini-3.1-flash-lite"
"15","Perfectly follows all instructions, providing a creative, immersive story and three catchy slogans within the word count.",1,2,15,36,"gemini-3.1-flash-lite"
"100","Provides a coherent narrative but fails to include the required three catchy marketing slogans at the end.",2,1,15,36,"gemini-3.1-flash-lite"
"14","Focuses too narrowly on sleeping pods rather than the holistic, high-tech airport experience requested in the prompt.",3,3,15,36,"gemini-3.1-flash-lite"
"72","Fails to write a cohesive story and includes irrelevant information about existing airports instead of the 2050 vision.",4,4,15,36,"gemini-3.1-flash-lite"
"81","Best alignment with the prompt, providing a creative narrative and relevant slogans for a futuristic airport experience.",1,4,15,37,"gemini-3.1-flash-lite"
"106","Provides a structured airport experience, though it lacks the futuristic, high-tech vision requested for the year 2050.",2,2,15,37,"gemini-3.1-flash-lite"
"64","Focuses on functional requirements rather than the requested narrative story and marketing slogans.",3,3,15,37,"gemini-3.1-flash-lite"
"89","Completely irrelevant to the prompt as it discusses travel tips for Iceland instead of a futuristic airport.",4,1,15,37,"gemini-3.1-flash-lite"
"103","Best integration of futuristic technology and narrative flow, perfectly aligning with the influencer persona's tech-forward interests.",1,4,15,38,"gemini-3.1-flash-lite"
"79","Strong focus on traveler well-being, but lacks the specific futuristic technological innovation requested in the prompt.",2,1,15,38,"gemini-3.1-flash-lite"
"66","Provides a poetic vision of nature, but fails to include the required marketing slogans for the second part.",3,3,15,38,"gemini-3.1-flash-lite"
"86","Lacks a cohesive narrative story and completely misses the required marketing slogans for the second part.",4,2,15,38,"gemini-3.1-flash-lite"
"104","Best alignment with the 2050 futuristic theme, incorporating advanced concepts like AR, hyperloops, and holographic displays.",1,3,15,39,"gemini-3.1-flash-lite"
"13","Good focus on the traveler's emotional experience and VR entertainment, though less visionary than Option C.",2,2,15,39,"gemini-3.1-flash-lite"
"4","Provides a functional narrative but lacks the creative, high-tech flair required for a 2050 futuristic airport.",3,4,15,39,"gemini-3.1-flash-lite"
"62","Fails to provide the requested story and slogans, offering only a generic list of airport features instead.",4,1,15,39,"gemini-3.1-flash-lite"
"52","Best balance of futuristic technology, immersive storytelling, and professional marketing slogans that fit the 2050 theme perfectly.",1,3,15,40,"gemini-3.1-flash-lite"
"114","Strong narrative flow and creative use of VR and AI, though the slogans were missing from the provided text.",2,4,15,40,"gemini-3.1-flash-lite"
"93","Includes creative ideas like forcefields, but the writing style feels less professional and more like a basic summary.",3,1,15,40,"gemini-3.1-flash-lite"
"36","Lacks the futuristic, high-tech 'wow' factor, focusing instead on mundane improvements to current airport processes.",4,2,15,40,"gemini-3.1-flash-lite"
"120","Best integration of futuristic tech, Japanese aesthetics, and a cohesive, immersive traveler experience.",1,2,16,1,"gemini-3.1-flash-lite"
"26","Highly creative and visionary, though the skyscraper-airport concept feels less grounded than Option B.",2,3,16,1,"gemini-3.1-flash-lite"
"86","Focuses on helpful AI, but lacks the comprehensive, high-tech infrastructure described in the top options.",3,1,16,1,"gemini-3.1-flash-lite"
"151","Too focused on basic utility and lacks the futuristic, innovative flair expected for a 2050 airport.",4,4,16,1,"gemini-3.1-flash-lite"
"2","Captures the multisensory, immersive, and futuristic aesthetic perfectly, aligning best with the influencer persona and design goals.",1,1,16,2,"gemini-3.1-flash-lite"
"16","Strong focus on efficiency and technology, though it lacks the creative narrative flair found in Option A.",2,3,16,2,"gemini-3.1-flash-lite"
"127","Functional and practical, but the slogans are generic and lack the futuristic, high-tech inspiration requested.",3,2,16,2,"gemini-3.1-flash-lite"
"110","Too focused on traditional VIP services; lacks the innovative, cutting-edge technological vision required for a 2050 airport.",4,4,16,2,"gemini-3.1-flash-lite"
"134","Best alignment with the prompt; includes a creative story and specific, innovative concepts like Convini-Pods.",1,3,16,3,"gemini-3.1-flash-lite"
"137","Strong focus on personalized technology and efficient transit, though it lacks the requested marketing slogans.",2,2,16,3,"gemini-3.1-flash-lite"
"3","Includes slogans as requested, but the story is generic and lacks the futuristic, high-tech Tokyo vision.",3,4,16,3,"gemini-3.1-flash-lite"
"128","Weakest entry; it is too vague and fails to provide the required marketing slogans entirely.",4,1,16,3,"gemini-3.1-flash-lite"
"125","Perfectly captures the futuristic, high-tech, and seamless experience requested by the persona.",1,1,16,4,"gemini-3.1-flash-lite"
"22","Creative and immersive, though the Pokemon reference feels slightly less professional for a global airport.",2,3,16,4,"gemini-3.1-flash-lite"
"37","Focuses too much on basic current-day technology rather than the requested 2050 futuristic vision.",3,4,16,4,"gemini-3.1-flash-lite"
"12","Lacks a cohesive narrative and fails to provide the requested creative futuristic storytelling.",4,2,16,4,"gemini-3.1-flash-lite"
"97","Best alignment with the futuristic 2050 vision, incorporating immersive AR, sustainability, and personalized wellness experiences.",1,4,16,5,"gemini-3.1-flash-lite"
"19","Strong focus on biometric integration and AI automation, though it lacks the creative flair of the top choice.",2,1,16,5,"gemini-3.1-flash-lite"
"108","Provides a functional vision of airport flow, but relies on somewhat dated concepts like moving walkways and LED lights.",3,2,16,5,"gemini-3.1-flash-lite"
"78","Weakest entry as it reads like a generic advertisement rather than a creative, futuristic narrative.",4,3,16,5,"gemini-3.1-flash-lite"
"147","Perfectly balances the requested futuristic tech with cultural aesthetics, creating a cohesive and immersive traveler narrative.",1,4,16,6,"gemini-3.1-flash-lite"
"136","Strong focus on high-tech efficiency and luxury, though it lacks the cultural depth requested in the prompt.",2,1,16,6,"gemini-3.1-flash-lite"
"29","Offers creative leisure ideas, but lacks a professional, cohesive vision for a high-end futuristic airport experience.",3,3,16,6,"gemini-3.1-flash-lite"
"77","Too generic and lacks the futuristic, high-tech innovation required for a 2050 airport design concept.",4,2,16,6,"gemini-3.1-flash-lite"
"74","Best alignment with the prompt; it provides a cohesive, professional, and highly detailed futuristic travel experience.",1,2,16,7,"gemini-3.1-flash-lite"
"90","Strong focus on personalized technology and security, though the narrative flow is less immersive than Option B.",2,4,16,7,"gemini-3.1-flash-lite"
"158","Creative and imaginative, but the narrative lacks the professional polish and logical consistency of the top options.",3,3,16,7,"gemini-3.1-flash-lite"
"47","Weakest option; it describes a standard airport experience rather than a truly futuristic or innovative one.",4,1,16,7,"gemini-3.1-flash-lite"
"103","Best balance of futuristic technology, cultural integration, and a cohesive, immersive narrative experience for travelers.",1,2,16,8,"gemini-3.1-flash-lite"
"115","Strong focus on solving real-world travel pain points like traffic, though the narrative is less descriptive.",2,3,16,8,"gemini-3.1-flash-lite"
"107","Practical and relatable, but lacks the visionary, high-tech wonder expected of a 2050 futuristic airport design.",3,4,16,8,"gemini-3.1-flash-lite"
"116","Too abstract and dystopian; teleportation removes the 'airport' experience entirely, failing the design brief's intent.",4,1,16,8,"gemini-3.1-flash-lite"
"18","Provides the most immersive, well-written narrative that perfectly captures the futuristic, stress-free travel experience requested.",1,1,16,9,"gemini-3.1-flash-lite"
"73","Strong narrative flow and creative use of VR, though slightly less polished in tone than Option A.",2,2,16,9,"gemini-3.1-flash-lite"
"42","Good conceptual ideas, but the narrative is too brief and lacks the descriptive storytelling depth of the top options.",3,4,16,9,"gemini-3.1-flash-lite"
"157","The writing style is overly promotional and lacks the sophisticated, visionary tone expected for a 2050 design concept.",4,3,16,9,"gemini-3.1-flash-lite"
"91","Most immersive and creative vision, perfectly capturing the high-tech, futuristic lifestyle requested by the influencer persona.",1,1,16,10,"gemini-3.1-flash-lite"
"85","Strong, concise narrative that balances technological innovation with a focus on traveler comfort and emotional well-being.",2,3,16,10,"gemini-3.1-flash-lite"
"65","Good inclusion of environmental elements, but the narrative tone is slightly less engaging than the top options.",3,2,16,10,"gemini-3.1-flash-lite"
"13","Lacks the creative, futuristic flair of the other options, reading more like a standard review than a vision.",4,4,16,10,"gemini-3.1-flash-lite"
"52","Perfectly aligns with the 2050 futuristic theme, incorporating advanced technology like holograms, drones, and Hyperloop systems.",1,3,16,11,"gemini-3.1-flash-lite"
"130","Strong aesthetic vision and atmosphere, though it lacks the explicit high-tech focus requested for a 2050 airport.",2,4,16,11,"gemini-3.1-flash-lite"
"121","Creative terminal concepts, but focuses on historical tourism rather than the requested futuristic, high-tech airport experience.",3,2,16,11,"gemini-3.1-flash-lite"
"61","Fails to address the futuristic 2050 context, focusing instead on basic modern-day amenities like charging outlets.",4,1,16,11,"gemini-3.1-flash-lite"
"35","Perfectly aligns with the futuristic, high-tech, and frictionless travel experience requested for the 2050 Tokyo airport.",1,4,16,12,"gemini-3.1-flash-lite"
"129","Offers a creative, tranquil, and personalized humanoid robot service that enhances the passenger's emotional well-being.",2,3,16,12,"gemini-3.1-flash-lite"
"10","Practical and helpful, but focuses on incremental improvements rather than the truly transformative futuristic vision requested.",3,2,16,12,"gemini-3.1-flash-lite"
"51","Irrelevant to the prompt as it describes a past personal vacation rather than a futuristic airport design.",4,1,16,12,"gemini-3.1-flash-lite"
"149","Best integration of luxury, efficiency, and immersive technology, perfectly matching the futuristic influencer persona.",1,4,16,13,"gemini-3.1-flash-lite"
"81","Strong narrative flow and practical futuristic features like robot luggage delivery, though slogans lack creativity.",2,2,16,13,"gemini-3.1-flash-lite"
"82","Creative focus on cultural immersion, but lacks the high-tech infrastructure depth expected for a 2050 airport.",3,1,16,13,"gemini-3.1-flash-lite"
"45","Weakest because it lacks a narrative story and fails to provide the required marketing slogans.",4,3,16,13,"gemini-3.1-flash-lite"
"75","Best alignment with 2050 futuristic tech, featuring AI, VR, and automated logistics, perfectly matching the influencer persona.",1,2,16,14,"gemini-3.1-flash-lite"
"30","Strong sensory storytelling and innovative teleportation concept, though slightly less tech-focused than Option B.",2,4,16,14,"gemini-3.1-flash-lite"
"28","Pleasant atmosphere, but lacks the cutting-edge technological innovation required for a 2050 futuristic airport vision.",3,3,16,14,"gemini-3.1-flash-lite"
"7","Too mundane and lacks futuristic elements, describing features common in many existing modern airports today.",4,1,16,14,"gemini-3.1-flash-lite"
"33","Perfectly aligns with the futuristic, tech-driven, and eco-conscious vision requested for a 2050 airport experience.",1,3,16,15,"gemini-3.1-flash-lite"
"55","Creative and culturally immersive, though it focuses more on entertainment than the holistic airport infrastructure requested.",2,2,16,15,"gemini-3.1-flash-lite"
"106","Offers good practical amenities, but lacks the high-tech, futuristic innovation required for a 2050 design concept.",3,4,16,15,"gemini-3.1-flash-lite"
"155","Describes standard, current-day airport procedures rather than the futuristic, innovative experience requested by the prompt.",4,1,16,15,"gemini-3.1-flash-lite"
"104","Best balance of professional tone, comprehensive futuristic technology, and clear alignment with the 2050 vision.",1,3,16,16,"gemini-3.1-flash-lite"
"114","Strong narrative flow and creative imagery, though slightly less detailed regarding infrastructure than Option C.",2,4,16,16,"gemini-3.1-flash-lite"
"21","Functional and efficient, but the writing style is repetitive and lacks the sophisticated flair of the top options.",3,2,16,16,"gemini-3.1-flash-lite"
"71","Focuses too heavily on spa services rather than the innovative, high-tech airport infrastructure requested.",4,1,16,16,"gemini-3.1-flash-lite"
"43","Best alignment with the 2050 futuristic theme, incorporating biometrics, robotics, and immersive environmental design.",1,1,16,17,"gemini-3.1-flash-lite"
"95","Strong narrative flow and character perspective, though the technology described feels less advanced than Option A.",2,3,16,17,"gemini-3.1-flash-lite"
"49","Focuses on practical pain points but lacks the creative, high-tech futuristic vision requested for the 2050 design.",3,2,16,17,"gemini-3.1-flash-lite"
"17","Fails to address the futuristic technology requirement, focusing instead on exclusionary design rather than innovative passenger experience.",4,4,16,17,"gemini-3.1-flash-lite"
"15","Perfectly aligns with the prompt requirements, providing a cohesive story and three distinct, catchy marketing slogans.",1,3,16,18,"gemini-3.1-flash-lite"
"25","Captures the futuristic theme well, though it lacks the structured narrative and professional polish of Option C.",2,4,16,18,"gemini-3.1-flash-lite"
"69","Focuses on luxury but fails to address the specific futuristic, high-tech requirements requested in the prompt.",3,1,16,18,"gemini-3.1-flash-lite"
"89","Completely irrelevant to the prompt as it discusses a travel guide for Iceland instead of a Tokyo airport.",4,2,16,18,"gemini-3.1-flash-lite"
"23","Best aligns with the futuristic, personalized, and AI-driven vision requested for a 2050 Tokyo airport experience.",1,1,16,19,"gemini-3.1-flash-lite"
"102","Strong focus on high-tech infrastructure and efficiency, though slightly less emphasis on the immersive cultural experience.",2,4,16,19,"gemini-3.1-flash-lite"
"145","Provides good practical improvements but lacks the visionary, futuristic flair required for a 2050 design concept.",3,2,16,19,"gemini-3.1-flash-lite"
"142","Focuses on existing technology rather than the requested futuristic, innovative experience for the year 2050.",4,3,16,19,"gemini-3.1-flash-lite"
"8","Best alignment with the prompt's request for a creative, futuristic, and immersive narrative experience.",1,3,16,20,"gemini-3.1-flash-lite"
"154","Strong professional tone and clear marketing slogans, though slightly less imaginative than Option C.",2,2,16,20,"gemini-3.1-flash-lite"
"143","Includes all required elements but lacks the narrative depth and creative flair of the top options.",3,4,16,20,"gemini-3.1-flash-lite"
"59","Fails to meet the word count requirement and focuses on a mundane scenario rather than futuristic innovation.",4,1,16,20,"gemini-3.1-flash-lite"
"93","Best alignment with the futuristic, high-tech, and personalized experience requested for a 2050 traveler.",1,4,16,21,"gemini-3.1-flash-lite"
"50","Strong focus on sustainability and innovation, though it lacks the immersive narrative storytelling requested.",2,3,16,21,"gemini-3.1-flash-lite"
"6","Practical and functional, but feels more like an incremental upgrade than a truly futuristic 2050 vision.",3,2,16,21,"gemini-3.1-flash-lite"
"105","The atmosphere feels sterile and slightly dystopian rather than an inviting, innovative travel experience.",4,1,16,21,"gemini-3.1-flash-lite"
"5","Perfectly captures the futuristic, high-tech, and stress-free narrative requested by the persona.",1,4,16,22,"gemini-3.1-flash-lite"
"38","Provides a creative, specific technological solution for airport navigation, though lacks a full narrative story.",2,3,16,22,"gemini-3.1-flash-lite"
"64","Focuses on unrealistic logistical concepts like a relocatable airport rather than the traveler's experience.",3,1,16,22,"gemini-3.1-flash-lite"
"141","Describes current airport frustrations rather than proposing a futuristic, innovative vision for 2050.",4,2,16,22,"gemini-3.1-flash-lite"
"72","Best alignment with the 2050 futuristic theme, providing a creative, immersive narrative and relevant marketing slogans.",1,1,16,23,"gemini-3.1-flash-lite"
"34","Strong focus on specific futuristic technologies like robotics, though it lacks the narrative depth of Option A.",2,3,16,23,"gemini-3.1-flash-lite"
"87","Describes a functional airport experience but fails to capture the futuristic 2050 vision requested in the prompt.",3,2,16,23,"gemini-3.1-flash-lite"
"118","Completely irrelevant to the airport design task, focusing instead on generic vacation planning marketing copy.",4,4,16,23,"gemini-3.1-flash-lite"
"150","Best narrative flow; it effectively captures the futuristic, high-tech, and personalized experience requested in the prompt.",1,1,16,24,"gemini-3.1-flash-lite"
